Unnamed: 0,No.,Title,Artist(s),lyrics,genres
31,32,"""Sailing""",Christopher Cross,"31 ContributorsSailing LyricsA gentle yet emotionally powerful song, “Sailing” was released as a the second single from Cross' debut album (after “Ride Like The Wind”). Originally “I Really Don’t Know Anymore” was considered for Cross'… Read More 
Well, it's not far down to paradise
At least it's not for me
And if the wind is right, you can sail away
And find tranquility
Oh, the canvas can do miracles
Just you wait and see
Believe me

It's not far to never never land
No reason to pretend
And if the wind is right, you can find the joy
Of innocence again
Oh, the canvas can do miracles
Just you wait and see
Believe me

Sailing
Takes me away to where I've always heard it could be
Just a dream and the wind to carry me
Soon, I will be free

Fantasy
It gets the best of me
When I'm sailing
All caught up in the reverie
Every word is a symphony
Won't you believe me?

Sailing
Takes me away to where I've always heard it could be
Just a dream and the wind to carry me
And soon, I will be free


Well, it's not far back to sanity
At least it's not for me
And if the wind is right, you can sail away
And find serenity
Oh, the canvas can do miracles
Just you wait and see
Really, believe me

Sailing
Takes me away to where I've always heard it could be
Just a dream and the wind to carry me
And soon, I will be free","soft rock, 80s, pop, singer-songwriter, yacht rock"
32,33,"""Longer""",Dan Fogelberg,"9 ContributorsLonger LyricsDan Fogelberg wrote “Longer” while on vacation in Maui. It remains his biggest hit, peaking at #2 on the US Hot 100. It also topped Billboard’s Adult Contemporary chart for a week in February of 1980.
… Read More Longer than there've been fishes in the ocean
Higher than any bird ever flew
Longer than there`ve been stars up in the heavens
I've been in love with you
Stronger than any mountain cathedral
Truer than any tree ever grew
Deeper than any forest primeval
I am in love with you
I'll bring fire in the winters
You'll send showers in the springs
We`ll fly through the falls and summers
With love on our wings
Through the years as the fire starts to mellow
Burning lines in the book of our lives
Though the binding cracks and the pages start to yellow
I'll be in love with you
I'll be in love with you
Longer than there've been fishes in the ocean
Higher than any bird ever flew
Longer than there`ve been stars up in the heavens
I've been in love with you
I am in love with you","singer-songwriter, soft rock, folk, classic rock, folk rock"
33,34,"""Coward of the County""",Kenny Rogers,"29 ContributorsCoward of the County Lyrics“Coward of the County” is a country song written by Roger Bowling and Billy Ed Wheeler, and recorded by American country music singer Kenny Rogers. It was released as the second single from the Triple… Read More 
Everyone considered him the coward of the county
He'd never stood one single time to prove the county wrong
His mama named him Tommy, but folks just called him yellow
Something always told me they were reading Tommy wrong

He was only ten years old when his daddy died in prison
I looked after Tommy 'cause he was my brother's son
I still recall the final words my brother said to Tommy
""Son, my life is over, but yours has just begun""

Promise me, son, not to do the things I've done
Walk away from trouble if you can
Now it don't mean you're weak if you turn the other cheek
I hope you're old enough to understand
Son, you don't have to fight to be a man

There's someone for everyone, and Tommy's love was Becky
In her arms he didn't have to prove he was a man
One day while he was working, the Gatlin boys came calling
They took turns at Becky, n'there was three of them
Tommy opened up the door and saw his Becky crying
The torn dress, the shattered look was more than he could stand
He reached above the fireplace, took down his daddy's picture
As a tear fell on his daddy's face, he heard these words again

Promise me, son, not to do the things I've done
Walk away from trouble if you can
Now it won't mean you're weak if you turn the other cheek
I hope you're old enough to understand
Son, you don't have to fight to be a man

The Gatlin boys just laughed at him
When he walked into the barroom
One of them got up and met him half way cross the floor
Tommy turned around they said, ""Hey look, old yella's leavin'""
But you could've heard a pin drop
When Tommy stopped and locked the door
Twenty years of crawling was bottled up inside him
He wasn't holding nothing back, he let 'em have it all
When Tommy left the bar room, not a Gatlin boy was standing
He said, ""This one's for Becky"" as he watched the last one fall
N' I heard him say

I promised you, Dad, not to do the things you've done
I walk away from trouble when I can
Now please don't think I'm weak, I didn't turn the other cheek
And Papa, I sure hope you understand
Sometimes you gotta fight when you're a man

Everyone considered him the coward of the county","country, classic country, kenny rogers, male vocalists, oldies"
34,35,"""Ladies' Night""",Kool & the Gang,"21 ContributorsLadies Night Lyrics
Ooh, oh, yeah, yeah, oh, what a night
It's ladies night, wooh
This is your night tonight
Everything's gonna be alright
This is your night tonight
Come on, girls!

Girls, we've all got one
A night that's special everywhere (Everywhere)
From New York
To Hollywood
It's ladies night and, girl, the feeling's good

Oh yes, it's ladies night
And the feeling's right
Oh yes, it's ladies night
Oh, what a night (Oh, what a night)
Oh yes, it's ladies night
And the feeling's right
Oh yes, it's ladies night
Oh, what a night (Oh, what a night)

This is your night tonight
Everything's gonna be alright
This is your night tonight
Everything's gonna be alright

Romantic lady, ooh, oh yeah
Single baby
Mmm, sophisticated mama (Wooh)
Come on you disco baby, yeah, yeah
Stay with me tonight

If you hear any noise
It ain't the boys, it's ladies night (Shh)
Ah-ha
Come on, girls!
Gonna step out ladies night
Steppin' out ladies night
Gonna step out ladies night
Steppin' out ladies night

Oh yes, it's ladies night
And the feeling's right
Oh yes, it's ladies night
Oh, what a night (Oh, what a night)
Oh yes, it's ladies night
And the feeling's right
Oh yes, it's ladies night
Oh, what a night (Oh, what a night)

On disco lights your name will be seen
You can fulfil all of your dreams
Party here, party there, everywhere
This is our night, ladies, you got to be there

This is your night tonight
Everything's gonna be alright
This is your night tonight
Everything's gonna be
Oh, ladies night (Alright)
This is your night tonight (Yeah, yeah, yeah) (Come on, let's all celebrate)
Everything's gonna be alright
This is your night tonight (Yeah, yeah, yeah)
Everything's gonna be alright
This is your night tonight (Come on, let's all celebrate)
Everything's gonna be alright
This is your night tonight (Oh, ladies night)
Everything's gonna be alright
This is your night tonight (Come on, let's all celebrate)
Everything's gonna be alright (This is our ladies night)
This is your night tonight (This is our ladies night)
Everything's gonna be alright (Wooh)
This is your night tonight (Come on, let's all celebrate)
Everything's gonna be alright ('Cause it's ladies night)
This is your night tonight
Everything's gonna be alright
This is your night tonight (Come on, let's all celebrate)
Everything's gonna be alright (Yeah, yeah)
This is your night tonight
Everything's gonna be alright","funk, soul, Disco, 70s, 80s"
35,36,"""Too Hot""",Kool & the Gang,"12 ContributorsToo Hot Lyrics
At seventeen, we fell in love
High school sweethearts, love was so brand new
We took the vows of man and wife
Forever, for life

I remember how we made our way
A little patience, the time we prayed
Can't imagine that this love is through
Feelin' the pain, girl, when you lose

Oh, it's too hot (Too hot)
Too hot, lady (Too hot)
Gotta run for shelter
Gotta run for shade
It's too hot (Too hot)
Too hot, lady (Too hot)
We gotta cool this anger
What a mess we've made
So long ago
You were my love, oh, my love

Flyin' high, we never took the time
To stop and feel the need
Funny how those years go by
Changing you, changing me

I remember love's fever
In our hearts, girl, and in our minds
Can't imagine that this love is through
Feelin' the pain, girl, when you lose

Oh, it's too hot (Too hot)
Too hot, lady (Too hot)
Gotta run for shelter
Gotta run for shade
It's too hot (Too hot)
Too hot, lady (Too hot)
Gotta cool this anger
What a mess we've made
So long ago
You were my love
Feeling the pain

Oh, it's too hot (Too hot)
Too hot, lady (Too hot)
Gotta run for shelter
Gotta run for shade
It's too hot (Too hot)
Too hot, lady (Too hot)
Gotta cool this anger
From this mess that we've made
Oh, it's too hot (Too hot)
Too hot, lady (Too hot)
Gotta run for shelter
Gotta run for shade
It's too hot (Too hot)
So, so hot, lady (Too hot)
Gotta cool this anger
Oh, gotta cool this mess we've made
It's so, so hot, baby (Too hot)
Yes, it's so hot (Too hot)
I just can't take it
I can't stand no more, baby
We were once lovers (Too hot)
We took our vows (Too hot)
A man and wife
Forever
Whoa (Too hot, too hot), oh-oh, oh-oh
Baby (Too hot)
Please, won't you listen? (Too hot)
It hurt me so bad
But I know I've got to leave (Too hot)
It's too hot (Too hot)
Gotta run for shelter, baby
Gotta run for shade
It's too hot (Too hot)
It's so, so hot, baby (Too hot)
Gotta cool this anger
Gotta cool this mess we've made
It's so warm (Too hot)
It's so warm (Too hot)
It's hot baby, yeah
Gotta run for shade
Come on (Too hot)
I'm leaving (Too hot)
Goodbye
Don't cry","funk, soul, Disco, 70s, 80s"
36,37,"""Take Your Time (Do It Right)""",The S.O.S. Band,"15 ContributorsTake Your Time (Do It Right) Lyrics“Take Your Time (Do It Right)” was the debut single of The SOS Band. It was internationally successful, peaking at #3 in both the US and New Zealand in the summer of 1980, and reaching the top 40 in several… Read More 
Let's do it
Let's do it
Let's do it
Let's do it
Oo-ooh, baby
Let's do it
Take your time
Let's do it
Come on, baby
Oo-ooh, baby
Let's do it
Take your time
Let's do it

You know you ought to slow down
You've been working too hard and that's a fact
Sit back and relax a while
Take some time to laugh and smile
Lay your heavy load down
So we can stop and kick back
It seems we never take the time to do
All the things we want to, yeah

Now, baby we can do it
Take the time, do it right
We can do it, baby
Do it tonight
Baby, we can do it
Take the time, do it right
We can do it, baby
Do it tonight
Baby, we can do it
Take the time, do it right
We can do it, baby
Do it tonight
Baby, we can do it
Take the time, do it right
We can do it, baby
Do it tonight

The love I feel for you
You feel for me
One life is all we have to live
Our love is all we have to give, yeah
There are so many things for us
To do and see, yeah
Let's take some time to be alone
Lock the door, pull out the phone, yeah

And baby, we can do it
Take the time, do it right
We can do it, baby
Do it tonight
Baby, we can do it
Take the time, do it right
We can do it, baby
Do it tonight
Baby, we can do it
Take the time, do it right
We can do it, baby
Do it tonight
Baby, we can do it
Take the time, do it right
We can do it, baby
Do it tonight

Take your time
Take the time
Take the time
Take the time
Take your time (Take your time, take your time)
Ooh baby, take your time (Take your time, baby, take your time)
Take your time (Take your time, take your time)
Take your time (Take your time, baby, take your time)
Take your time (Take your time, take your time)
Take your time (Take your time, baby, take your time)
Take your time, ooh baby (Take your time, take your time)
Take your time (Take your time, baby, take your time)
Take your time (Take your time)

Take your time
Ooh baby, take your time
If it takes all night
You can do it, you can do it
You can do it, alright
You can do it, you can do it
To the early morning light
You can do it, come on, baby
You can do it all night
Take your time, come on, baby
Let's do it tonight
Take your time, baby
If it takes all night
You can do it, you can do it
Come on, let's do it, do it right
Take your time, ooh baby
Come on, let's do, let's do, let's do it all night
Ooh baby
You can do it, do it right
Take your time, let's do it
If it takes all night
Come on baby, let's do it
To the early morning light

Let's do it, let's do it (Let's do it)
Let's do it, do it right
Come on, baby, let's do it (Let's do it)
If it takes all night
Come on, baby, let's do it (Let's do it)
Let's do it, do it right
Come on, honey, let's do it (Let's do it)
If it takes all night
Let's do it, let's do it (Let's do it)
Let's do it, do it right
Come on, baby, let's do it (Let's do it)
If it takes all night
Come on, honey, let's do it (Let's do it)
Let's do it tonight
We can do it, we can do it (Let's do it)
Let's do it, do it right

Baby, we can do it
Take your time, do it right
We can do it, baby
Do it tonight
Baby, we can do it
Take your time, do it right
We can do it, baby
Do it tonight
Baby, we can do it
Take the time, do it right
We can do it, baby
Do it tonight
Now baby, we can do it
Take the time, do it right
We can do it, baby
Come on and do it tonight
Baby, we can do it
Take the time, do it right
We can do it, baby
Come on, let's do it tonight","funk, soul, Disco, 80s, rnb"
37,38,"""No More Tears (Enough Is Enough)""",Barbra Streisand & Donna Summer,"9 ContributorsNo More Tears (Enough Is Enough) Lyrics
Hmmm, hmmm hmmm
Oooh oooh ooh
It's raining, it's pouring
My love life is boring me to tears
After all these years

No sunshine, no moonlight
No stardust, no sign of romance
We don't stand a chance

I always dreamed I'd find the perfect lover
But he turned out to be like every other man
I've loved
I've loved

Raining (Raining)
Pouring (Pouring)
There's nothing left for us here
And we won't waste another tear
Ah ah ah hey hey ah

If you've had enough
Don't put up with his stuff
Don't you do it

If you've had your fill
Get the check, pay the bill
You can do it

Tell him to just get out

Nothing left to talk about

Pack his raincoat, show him out

Just look him in the eye and simply shout:
Enough is enough (Enough)
I can't go on, I can't go on no more, no
Enough is enough (Enough)
I've loved
I've loved
Enough is enough
Enough is enough
That's enough

If you've reached the end
Don't pretend that is right when it's over

(It's over)
If the feeling is gone
Don't think twice just move on
Get it over

(Over, over)

Tell him to just get out
Say it clearly, spell it out:
Enough is enough is enough
I can't go on, I can't go on no more, no
Enough is enough is enough
I want him out, I want him out that door now
Enough is enough
Enough is enough
That's enough

I always dreamed I'd found the perfect lover
But he turned out to be like every other man
I've loved (I had no choice from the start)
I've loved (I've gotta listen to my heart)
I've loved (Tearing us apart)

Enough is enough is enough
I can't go on, I can't go on no more, no
Enough is enough is enough
I want him out, I want him out that door now
Enough is enough
Enough is enough
That's enough

No more tears (No more tears)
No more tears (No more tears)
No more tears (No more tears)
No more tears (No more tears)
Enough is enough is enough is enough is enough is enough
I've had it, you've had it, she's had it, we've had it

I always dreamed I'd found the perfect lover

But he turned out to be like every other man

I had no choice from the start
I've gotta listen to my heart
Tearing us apart
Enough is enough is enough
I can't go on, I can't go on no more, no
Enough is enough is enough
I want him out, I want him out that door now
Goodbye mister, goodbye, goodbye mister
Goodbye sugar
It's raining, it's pouring
There's nothing left for us here
And we won't waste another tear
No more tears
Is enough is enough is enough is enough is enough is enough is enough
Is enough!","Disco, female vocalists, 80s, soul, oldies"
38,39,"""More Love""",Kim Carnes,"7 ContributorsMore Love Lyrics
Ooh-ooh

Let it be soon don't hesitate
Make it now don't wait
Open your heart and let my love come in
I want the moment to start
When I can fill your heart with

More love and more joy
Than age or time could ever destroy
Oh honey now my love will be so sound
It'll take a hundred life times
To live it down
Wear it down
Tear it down

This is no fiction this is no act
This is real it's a fact
I'll always belong only to you
Each day I'll be living to
Make sure I'm giving you

More love and more joy
Than age or time could ever destroy
Oh honey now my love will be so sound
It'll take a hundred life times
To live it down
Wear it down
Tear it down


As we grow older no need to fear
When you need me
I'll be beside you every step of the way
A heart that's truthful
And keeping you youthful with

More love and more joy
Than age or time could ever destroy
Oh honey now my love will be so sound
It'll take a hundred life times
To live it down
Wear it down
Tear it down

Gonna give you more, ooh, and more joy
Than any age or time could ever destroy
Oh honey now my love will be so sound...","pop, 80s, female vocalists, soft rock, rock"
39,40,"""Pop Muzik""",M,"30 ContributorsPop Muzik Lyrics
(Pop, pop, pop muzik)
(Pop, pop, pop muzik)
Get up, get down
(Pop, pop, pop muzik)
(Pop, pop, pop muzik)

Radio, video
Boogie with a suitcase
You're living in a disco
Forget about the rat race
Let's do the Milkshake
Selling like a hotcake
Try some, buy some
Fee-fi-fo-fum
Talk about pop muzik
Talk about pop muzik

(Shoobie-doobie-doo-wop)
I want to dedicate it
(Pop, pop, shoo-wop)
Everybody made it
(Shoobie-doobie-doo-wop)
Infiltrate it
(Pop, pop, shoo-wop)
Activate it

New York, London, Paris, Munich
Everybody talk about pop muzik
Talk about (Pop)
Pop muzik
Talk about (Pop)
Pop muzik
Pop, pop, pop muzik
Pop, pop, pop muzik

Sing it in the subway
Shuffle with a shoe shine
Mix me a Molotov
I'm on the headline
Want to be a gunslinger?
Don't be a rock singer
Eenie, meenie, miney, mo
Which a-way you wanna go?
Talk about pop muzik
Talk about pop muzik

(Shoobie-doobie-doo-wop)
Right in betweenie
(Pop, pop, shoo-wop)
Eenie, meenie
(Shoobie-doobie-doo-wop)
Right in betweenie
(Pop, pop, shoo-wop)
You know what I meanie

Hit it!
Now you know when to say

(Talk about) Talk about
Pop muzik
(Talk about) Talk about
Pop muzik
Pop, pop, pop muzik
Pop, pop, pop muzik

All around the world (Pop, pop, pop muzik)
Wherever you are (Pop, pop, pop muzik)
Dance in the street, anything you like (Pop, pop, pop muzik)
Do it in your car in the middle of the night (Pop, pop, pop muzik)
La-la-la-la, la-la, la-la, la (Pop, pop, pop muzik)
La-la-la-la, la-la, la (Pop, pop, pop muzik)
La-la-la-la, la-la, la-la, la (Pop, pop, pop muzik)
La-la-la-la, la-la, la (Pop, pop, pop muzik)

Dance in the supermart
Dig it in the fast lane
Listen to the countdown
They're playing our song again
I can't get ""Jumping Jack""
I want to hold ""Get Back""
Moonlight, muzak
Knick-knack paddywhack
Talk about pop muzik
Talk about pop muzik

(Shoobie-doobie-doo-wop)
It's all around you
(Pop, pop, shoo-wop)
They want to surround you
(Shoobie-doobie-doo-wop)
It's all around you
(Pop, pop, shoo-wop)
Hit it

New York, London, Paris, Munich
Everybody talk about, mmm, pop muzik
Talk about (Pop)
Pop muzik
Talk about (Pop)
Pop muzik
Pop, pop, pop muzik
Pop, pop, pop muzik

Now, listen
Talk about (Pop, pop, pop muzik)
Talk about (Pop, pop, pop muzik)
Talk about the fever
Pop, pop, pop muzik
Pop, pop, pop muzik
Do you read me? Loud and clear
Hit it down (Pop, pop, pop muzik)
Hit it down, oh no! (Pop, pop, pop muzik)
Oh no! Oh, talk about
(Pop, pop, pop muzik)
Wrong way around (Pop, pop, pop muzik)
Upside down...","french, pop, rock, 80s, new wave"
40,41,"""Brass in Pocket""",The Pretenders,,"rock, new wave, 80s, female vocalists, classic rock"
41,42,"""Special Lady""","Ray, Goodman & Brown","8 ContributorsSpecial Lady Lyrics“Special Lady” peaked at #5 on the Billboard Hot 100 and topped Billboard’s R&B Singles chart for a week in February of 1980.
It was the first single released by the group under their new name Ray Goodman… Read More 
You must be a special lady
(Billy, you singin' first tenor or second?
Nah, Harry, I'm singin' second, man)
And a very exciting girl
(Al, bring that bass out, man
Hey man, I'll bring it out a little bit more)
You gotta be a special lady
(Let's get down on some harmony, come on)
'Cause you got me sittin' on top of the world
Sittin' on top of the world

Somehow I knew it would be you
To change my gray skies to blue
And it was strange when you called my name
Ever since that day I haven't been the same, ooh

Before I met you, my sun didn't want to shine
Then all of a sudden you snuck up from behind
Pop (Pop) went the reason in my mind

You must be a sweet special lady
And a very exciting girl (Ooh, so exciting)
You gotta be a special lady (What a lady)
'Cause you got me sittin' on top of the world
Sittin' on top of the world

I was like a song so out of key
Then you came and gave my soul a melody
Thanks to you, for pullin' me through
I've always lost but now I win with you

Before I met you, my sun didn't want to shine
Then all of a sudden you snuck up from behind
Pop (Pop) went the reason in my mind

You must be a special lady (I got a lady)
And a very exciting girl (So exciting, woo)
You gotta be a special lady (What a lady)
'Cause you got me sittin' on top of the world (Oh)
Sittin' on top of the world

Ooh, what a lady
Oh
Sittin' on top of the world
Sittin' on top of the world

Before I met you, my sun didn't want to shine
Then all of a sudden you snuck up from behind
Pop (Pop) went the reason in my mind

You must be a special lady (What a lady)
And a very exciting girl (So exciting)
You gotta be a special lady
'Cause you got me sittin' on top of the world (Ooh)
Sittin' on top of the world

You must be a special lady (What a lady)
And a very exciting girl (Mmm, what a lady)
You gotta be a special lady
(Get down, Billy Brown) (Alright, Harry Ray)
'Cause you got me sittin' on top of the world
Sittin' on top of the world
You must be a special lady (Woo)
And a very exciting girl (Oh, girl, oh, girl)
You gotta be a special lady
'Cause you got me sittin' on top of the world","soul, rnb, r&b, Old School soul, Home collection"
42,43,"""Send One Your Love""",Stevie Wonder,"11 ContributorsSend One Your Love Lyrics“Send One Your Love” was the lead single from Stevie Wonder’s Journey Through The Secret Life Of Plants, released in 1979. It peaked at #4 in the US the last week of the 1970s decade and stayed there for the… Read More 
Send her your love with a dozen roses
Make sure that she knows it with a flower from your heart
Show him your love, don't hold back your feelings
You don't need a reason when it's straight from the heart

I've heard so many say that the days of romance are no more
And people falling in love is so old fashioned
But waiting are they the day they once let slip away
Hiding need to fulfill their heart's desire for love’s passion

Send her your love with a dozen roses
Make sure that she knows it with a flower from your heart
Show him your love, don't hold back your feelings
You don't need a reason when it's straight from the heart

I know that people say two hearts beating as one is unreal
And can only happen in make believe stories
But so blind they all must be that they cannot believe what they see
For around us are miracles of love’s glory

Show him your love, don't hold back your feelings
You don't need a reason when it's straight from the heart","soul, funk, motown, pop, rnb"
43,44,"""The Second Time Around""",Shalamar,"6 ContributorsThe Second Time Around Lyrics
I know you've come a long way, baby
But you don't need that heart of stone, no
You proved that you could do it, do it, baby
You can make it on your own

But you can't keep runnin' away from love
'Cause the first one let you down, no, no, no
And though others try to satisfy you, baby
With me true love can still be found
Love can still be found

The second time around
Ooh, the second time is so much better, baby
The second time around
And I'll make it better than the first time

You know I really love you
And I paid for my mistakes, yes I did, girl
The more I try to hide my feelings, baby
This old heart gets in the way
And love won't let me wait

The second time around
Girl, with me, it's better than the first time
The second time around
Let's do it one more time, say it again
The second time around
All that I've been through, I'll do it again
Just as long as I'm with you
The second time around
Oh, the second time

Ooh
I'll make it so good to you, babe
I'll make it so good to you

Not like the first time (not like the first time)
Not like the first time (not like the first time)
Not like the first time
Talking 'bout the second time
Not like the first time (not like the first time)
Not like the first time (not like the first time)
Not like the first time
Talking 'bout the second time

You can't keep runnin' away from love
'Cause the first one let you down
And though others try to satisfy you, baby
With me true love can still be found

The second time around
I'm gonna keep you mine the second time, baby
The second time around
I'll know what to do just as long as I'm with you
The second time around
Do it one more time, say it again
The second time around","Disco, soul, funk, 80s, rnb"
