Unnamed: 0,No.,Title,Artist(s),lyrics,genres
0,1,"""Call Me""",Blondie,"57 ContributorsTranslationsSuomiFrançaisCall Me LyricsBlondie’s biggest hit, “Call Me”, was also the biggest song of 1980 in the US, spending six weeks at the top of the chart that spring. It also topped the UK pop chart and reached the top 20 in eight more… Read More ​

Color me your color, baby, color me your car
Color me your color, darling, I know who you are
Come up off your color chart
I know where you're coming from

Call me (Call me) on the line
Call me, call me any, anytime
Call me (Call me) I'll arrive
You can call me any day or night, call me
​
Cover me with kisses, baby, cover me with love
Roll me in designer sheets, I'll never get enough
Emotions come, I don't know why
Cover up love's alibi

Call me (Call me) on the line
Call me, call me any, anytime
Call me (Call me) I'll arrive
When you're ready, we can share the wine, call me


​​
Ooh, he speaks the languages of love
Ooh, amore, chiamami, chiamami
Ooh, appelle-moi, mon chéri, appelle-moi
Anytime, anyplace, anywhere, any way
Anytime, anyplace, anywhere, any day, any way


Call me
​​

Take me out and show me off
And put me on the scene
Dress me in the fashions of the 1980s
You're a man, no in-between
You know what your words can mean

Call me (Call me) on the line
Call me, call me any day or night
Call me (Call me) I'll arrive
Call me, call me into overtime, call me


Call me (Call me), my love
Call me, call me any, anytime
Call me (Call me) for a ride
Call me, call me for some overtime
Call me (Call me), my love, call me, call me in a sweet design
Call me (Call me), call me for your lover's lover's alibi
Call me (Call me) on the line
Call me, call me any, anytime

Call me, ah-ha, call me, ah-ha-ha
Call me, ah-ha-ha, call me any day or night
Call me, ooh-ooh-ah-ha-ha, ooh-ooh-ha-ha-ha
Call me, ah-ah-ooh
Call me, my, my sleek designs
Call me for a ride, call me inside
Call me, all night, all day, ah-ha, call me
Ooh-ooh-ooh-ooh-ah-ah-ah


Call me (Call me) in my life
Call me, call me any, any time
Call me (Call me) I'll arrive
Call me, call me for some overtime
Call me (Call me) in my life
Call me, call me and my sleek designs
Call me (Call me), call me for your lover's lover's alibi
Call me (Call me) in my life
Call me, call me any, any time
Call me (Call me)
Ooh-ooh-ooh
Call me, oh-oh
Call me (Call me) in my life
Call me, call me any, any time","new wave, 80s, rock, female vocalists, pop"
1,2,"""Another Brick in the Wall, Part II""",Pink Floyd,"6 ContributorsTranslationsNederlandsAnother Brick in the Wall (Part II) (Live at Earls Court, 21st October 1994) Lyrics
Ohhh, ohhhhh, ohhhh, ohhhh

We don't need no education
We don't need no thought control
No dark sarcasm in the classroom
Teachers leave them kids alone
Hey!
Teacher, leave them kids alone!

All in all it's just another brick in the wall
All in all you're just another brick in the wall

We don't need no education
We don't need no thought control
No dark sarcasm in the classroom
Teachers leave them kids alone
Hey!
Teacher, leave them kids alone!

All in all you're just another brick in the wall
All in all you're just another brick in the wall","Progressive rock, Psychedelic Rock, classic rock, rock, psychedelic"
2,3,"""Magic""",Olivia Newton-John,"13 ContributorsMagic LyricsAfter ONJ became an international star in 1978 with the success of the film Grease (and its soundtrack), her next film Xanadu, a roller-skating, disco fantasy flick, was considered a massive flop.
Its… Read More 
Come take my hand
You should know me
I've always been in your mind
You know I will be kind
I'll be guiding you

Building your dream
Has to start now
There's no other road to take
You won't make a mistake
I'll be guiding you

You have to believe we are magic
Nothin' can stand in our way
You have to believe we are magic
Don't let your aim ever stray

And if all your hopes survive
Destiny will arrive
I'll bring all your dreams alive
For you
I'll bring all your dreams alive
For you

From where I stand
You are home free
The planets align so rare
There's promise in the air
And I'm guiding you

Through every turn
I'll be near you
I'll come anytime you call
I'll catch you when you fall
I'll be guiding you

You have to believe we are magic
Nothin' can stand in our way
You have to believe we are magic
Don't let your aim ever stray

And if all your hopes survive
Destiny will arrive
I'll bring all your dreams alive
For you
I'll bring all your dreams alive
For you

Heyyyyyyyy!
You have to believe we are magic
Nothin' can stand in our way
You have to believe we are magic
Don't let your aim ever stray

And if all your hopes survive
Destiny will arrive
I'll bring all your dreams alive
For you
I'll bring all your dreams alive
For you","pop, female vocalists, 70s, 80s, country"
3,4,"""Rock with You""",Michael Jackson,"61 ContributorsTranslationsEspañolРусский (Russian)FrançaisDeutschRock With You Lyrics“Rock With You” was the second single from Off the Wall. It was written by British songwriter Rod Temperton, who had hands in the creation of various Michael Jackson songs, including this album’s #10-peaking… Read More 
Girl, close your eyes
Let that rhythm get into you
Don't try to fight it
There ain't nothin' that you can do
Relax your mind
Lay back and groove with mine

You gotta feel that heat
And we can ride the boogie
Share that beat of love

I wanna rock with you (All night)
Dance you into day (Sunlight)
I wanna rock with you (All night)
We're gonna rock the night away (Rock, right)

Out on the floor
There ain't nobody there but us
Girl, when you dance
There's a magic that must be love
Just take it slow
'Cause we got so far to go

When you feel that heat
And we gonna ride the boogie
Share that beat of love

I wanna rock with you (All night)
Dance you into day (Sunlight)
I wanna rock with you (All night)
We gon' rock the night away

And when the groove is dead and gone (Yeah)
You know that love survives
So we can rock forever on
I wanna rock with you
I wanna groove with you
I wanna rock with you
I wanna groove with you

I wanna rock (All night)
With you, girl (Sunlight)
Rock with you, rock with you, girl (Yeah)
(All night)
Dance the night away
I wanna rock with you (Yeah)
(All night)
Rock you into day (Sunlight)
I wanna rock with you (All night)
Rock the night away

Feel the heat, feel the beat (All night)
Rock you into day (Sunlight)
I wanna rock (All night)
Rock the night away","pop, 80s, dance, soul, funk"
4,5,"""Do That to Me One More Time""",Captain & Tennille,"11 ContributorsDo That to Me One More Time LyricsAfter feeling shunned by A&M Records, who began moving away from artists like Captain & Tennille and The Carpenters and signing new wave acts, the disco label Casablanca took interest in the duo. After… Read More 
Do that to me one more time
Once is never enough with a man like you
Do that to me one more time
I can never get enough of a man like you

Oh, kiss me like you just did
Oh baby
Do that to me once again

Pass that by me one more time
Once just isn't enough for my heart to hear
Oh, tell it to me one more time
I can never hear enough while I've got you near, oh

Say those words again like you just did
Oh baby
Tell it to me once again


Do that to me one more time
Once is never enough with a man like you
Woah, do that to me one more time
I can never get enough of a man like you

Oh kiss me like you just did
Oh baby
Do that to me once again

Oh baby
Do that to me once again
Oh baby
Do that to me one more time

(Do it again) one more time
(Do it again) one more time
(Do it again) one more time
(Do it again) one more time
(Do it again) one more time
(Do it again) one more time","pop, 70s, female vocalists, synth pop, soft rock"
5,6,"""Crazy Little Thing Called Love""",Queen,"57 ContributorsCrazy Little Thing Called Love LyricsQueen’s tribute to Elvis Presley and the early rockabilly style. Surprisingly, it was written in only 10 minutes while Freddie was in the bathtub.
It topped the US charts in February 1980.

From the band’s… Read More 

This thing called love
I just can't handle it
This thing called love
I must get 'round to it, I ain't ready
Crazy little thing called love

A-this thing (This thing)
Called love (Called love)
It cries (Like a baby)
In a cradle all night
It swings (Woo, woo)
It jives (Woo, woo)
It shakes all over like a jellyfish
Woo, I kinda like it
Crazy little thing called love

There goes my baby
She knows how to rock 'n' roll
She drives me crazy
She gives me hot and cold fever
Then she leaves me in a cool, cool sweat


I gotta be cool, relax, get hip
And get on my tracks
Take a back seat, hitch-hike
And take a long ride
On my motorbike until I'm ready
Crazy little thing called love


Yeah
I gotta be cool, relax, get hip
And get on my tracks
Take a back seat
Hitch-hike (Ah hum, ah hum)
And take a long ride on my motorbike
Until I'm ready (Ready Freddie)
Crazy little thing called love

This thing called love
I just can't handle it
This thing called love
I must get 'round to it
I ain't ready (Ooh ooh ooh ooh)
Crazy little thing called love

Crazy little thing called love, yeah, yeah
Crazy little thing called love, yeah, yeah
Crazy little thing called love, yeah, yeah
Crazy little thing called love, yeah, yeah
Crazy little thing called love, yeah, yeah
Crazy little thing called love, yeah, yeah
Crazy little thing called love, yeah, yeah
Crazy little thing called love, yeah, yeah","classic rock, rock, hard rock, glam rock, 80s"
6,7,"""Coming Up""",Paul McCartney,"22 ContributorsComing Up Lyrics“Coming Up” is the lead single from Paul McCartney’s second solo album. He recorded it himself on a farm in Scotland.
The studio version was originally released as the A-side with a live version on the… Read More 
You want a love to last forever
One that will never fade away
I wanna help you with your problem
Stick around, I say

Coming up (Ooh, ooh)
Coming up, yeah
Coming up like a flower
Coming up, I say (Ooh)

You want a friend you can rely on
One who will never fade away
And if you're searching for an answer
Stick around, I say

Coming up (Ooh, ooh)
Coming up
Coming up like a flower
Coming up, yeah


You want some peace and understanding
So everybody can be free
I know that we can get together
We can make it, stick with me

Coming up (Ooh, ooh)
Coming up (Can't you see?)
Coming up like a flower
Coming up for you and me

Coming up
Coming up

Coming up
Coming up, I say
Coming up like a flower
Coming up
I feel it in my bones
Yeah, yeah, yeah, yeah, yay

You want a better kind of future
One that everyone can share
You're not alone, we all could use it
Stick around, we're nearly there

Coming up (Ooh, ooh)
Coming up (Everywhere)
Coming up like a flower
Coming up, for all to share
Coming up, yeah
Coming up any way
Coming up like a flower
Coming up","classic rock, rock, british, singer-songwriter, pop"
7,8,"""Funkytown""",Lipps Inc.,"58 ContributorsTranslationsDeutschFunkytown LyricsThe 1979-80 signature disco hit  - considered the unofficial last and ending the disco era in pop/rock. Spent 4 weeks at the top of the Billboard charts (and in numerous others) – not due to its lyrics…
by a… Read More 
Gotta make a move to a town that's right for me
Town to keep me movin', keep me groovin' with some energy

Well, I talk about it, talk about it
Talk about it, talk about it
Talk about, talk about
Talk about movin'
Gotta move on
Gotta move on
Gotta move on


A-won't you take me to Funkytown?
Won't you take me to Funkytown?
Won't you take me to Funkytown?
Won't you take me to Funkytown?

Won't you take me to Funkytown?
Won't you take me to Funkytown?
Won't you take me to Funkytown?
Won't you take me to Funkytown?


Gotta make a move to a town that's right for me
Town to keep me movin', keep me groovin' with some energy

Well, I talk about it, talk about it
Talk about it, talk about it
Talk about, talk about
Talk about movin'
Gotta move on
Gotta move on
Gotta move on


A-won't you take me to Funkytown?
Won't you take me to Funkytown?
Won't you take me to Funkytown?
Won't you take me to Funkytown?


Won't you take me to Funkytown?
Won't you take me to Funkytown?
Won't you take me to Funkytown?
Won't you take me to Funkytown, yeah?

Won't you take me down to Funkytown?
Won't you take me down to Funkytown?
Won't you take me down to Funkytown?
Won't you take me down to Funkytown?
(Won't you take me to) Funkytown?
(Won't you take me to) Funkytown?
(Won't you take me to) Funkytown?
(Won't you take me to) Funkytown?
Take me, won't you take me?
Take me, won't you take me?
Take me, (won't you take me) won't you take me?
Take me, (won't you take me) won't you take me?
I wanna go (won't you take me) to Funkytown
I wanna go (won't you take me) to Funkytown
I wanna go (won't you take me) to Funkytown
I wanna go (won't you take me) to Funkytown","Disco, funk, 80s, pop, 70s"
8,9,"""It's Still Rock and Roll to Me""",Billy Joel,"45 ContributorsIt’s Still Rock and Roll to Me LyricsFrom the hit 1980 album Glass Houses, “It’s Still Rock and Roll to Me” was a #1 hit on the Billboard Hot 100 and spent 11 weeks in the top 10. Overseas, it reached #14 in the UK and #21 in New Zealand.
The… Read More 
What's the matter with the clothes I'm wearing?
Can't you tell that your tie's too wide?
Maybe I should buy some old tab collars?
Welcome back to the age of jive

Where have you been hidin' out lately, honey?
You can't dress trashy 'til you spend a lot of money

Everybody's talkin' 'bout the new sound funny
But it's still rock and roll to me

What's the matter with the car I'm driving?
Can't you tell that it's out of style?
Should I get a set of whitewall tires?
Are you gonna cruise the Miracle Mile?

Nowadays, you can't be too sentimental
Your best bet's a true baby blue Continental

Hot funk, cool punk, even if it's old junk
It's still rock and roll to me

Oh, it doesn't matter what they say in the papers
'Cause it's always been the same old scene
There's a new band in town, but you can't get the sound
From a story in a magazine
Aimed at your average teen

How about a pair of pink sidewinders
And a bright orange pair of pants?
Well you could really be a Beau Brummel baby
If you just give it half a chance

Don't waste your money on a new set of speakers
You'd get more mileage from a cheap pair of sneakers

Next phase, new wave, dance craze, anyways
It's still rock and roll to me
(Alright, Richie!)

Woo!
Ooh...

What's the matter with the crowd I'm seeing?
Don't you know that they're out of touch?
Should I try to be a straight 'A' student?
If you are then you think too much

Don't you know about the new fashion, honey?
All ya need are looks and a whole lotta money

It's the next phase, new wave, dance craze
Anyways – it's still rock and roll to me
Everybody's talkin' 'bout the new sound funny
But it's still rock and roll to me","classic rock, singer-songwriter, rock, pop, piano"
9,10,"""The Rose""",Bette Midler,"27 ContributorsThe Rose LyricsIn 1977 aspiring singer songwriter Amanda McBroom was under pressure from her manager to create a song that could help her get a record deal. While driving in her car in Los Angeles one day McBroom heard… Read More 
Some say love, it is a river
That drowns the tender reed
Some say love, it is a razor
That leaves your soul to bleed
Some say love, it is a hunger
An endless aching need
I say love, it is a flower
And you, its only seed

It's the heart, afraid of breaking
That never learns to dance
It's the dream, afraid of waking
That never takes the chance
It's the one who won't be taken
Who cannot seem to give
And the soul, afraid of dying
That never learns to live

When the night has been too lonely
And the road has been too long
And you think that love is only
For the lucky and the strong
Just remember in the winter
Far beneath the bitter snows
Lies the seed that with the sun's love
In the spring becomes the rose","female vocalists, pop, 80s, rock, singer-songwriter"
10,11,"""Escape (The Piña Colada Song)""",Rupert Holmes,"52 ContributorsEscape (The Piña Colada Song) LyricsRupert Holmes’s claim to fame – the hit that was the last number 1 of the ‘70s in the US. It was also a top 30 hit in New Zealand, Belgium, The Netherlands and the UK.
“Escape” is about a man wishing to… Read More 
I was tired of my lady
We'd been together too long
Like a worn out recording
Of a favorite song
So while she lay there sleeping
I read the paper in bed
And in the personal columns
There was this letter I read

If you like piña coladas
And gettin' caught in the rain
If you're not into yoga
If you have half a brain
If you like making love at midnight
In the dunes on the cape
Then I'm the love that you've looked for
Write to me and escape

I didn't think about my lady
I know that sounds kind of mean
But me and my old lady
Had fallen into the same old dull routine
So I wrote to the paper
Took out a personal ad
And though I'm nobody's poet
I thought it wasn't half bad

Yes, I like piña coladas
And gettin' caught in the rain
I'm not much into health food
I am into champagne
I've got to meet you by tomorrow noon
And cut through all this red tape
At a bar called O'Malley's
Where we'll plan our escape
So I waited with high hopes
And she walked in the place
I knew her smile in an instant
I knew the curve of her face
It was my own lovely lady
And she said, ""Aw, it's you""
Then we laughed for a moment
And I said, ""I never knew""

That you like piña coladas
And gettin' caught in the rain
And the feel of the ocean
And the taste of champagne
If you like making love at midnight
In the dunes on the cape
You're the lady I've looked for
Come with me and escape

If you like piña coladas
And gettin' caught in the rain
If you're not into yoga
If you have half a brain
If you like making love at midnight
In the dunes on the cape
Then I'm the love that you've looked for
Write to me and escape

Yes, I like piña coladas
And gettin' caught in the rain
I'm not much into health food
I am into champagne
I've got to meet you by tomorrow noon
And cut through all this red tape
At a bar called O'Malley's
Where we'll plan our escape","soft rock, pop, 70s, classic rock, one hit wonder"
11,12,"""Cars""",Gary Numan,"38 ContributorsCars LyricsGary Numan went the whole hog and created a purely electronic debut solo album, ditching any traces of his punk past and cementing his place as one of England’s newest genuine superstars (a status that proved… Read More 
Here in my car
I feel safest of all
I can lock all my doors
It's the only way to live
In cars
Here in my car
I can only receive
I can listen to you
It keeps me stable for days
In cars

Here in my car
Where the image breaks down
Will you visit me, please
If I open my door?
In cars
Here in my car
I know I've started to think
About leaving tonight
Although nothing seems right
In cars","new wave, synthpop, electronic, 80s, industrial"
12,13,"""Cruisin""",Smokey Robinson,"22 ContributorsCruisin’ Lyrics“Cruisin'” became a big pop hit for Smokey Robinson, peaking at #4 on the Billboard Hot 100 and #4 on Billboard’s R&B Singles chart in February 1980.
Guitarist Marv Tarplin had written the music five years… Read More 
(Cruisin')

Baby, let's cruise, away from here
Don't be confused, the way is clear
And if you want it, you got it, forever
This is not a one night stand, baby, yeah so

Let the music take your mind, ooh
Just release and you will find

You're gonna fly away
Glad you're goin' my way
I love it when we're cruisin' together
The music is played for love
Cruisin' is made for love
I love it when we're cruisin' together

Baby, tonight belongs to us
Everything's right, do what you must
And inch by inch, we get closer and closer
To every little part of each other, ooh baby, yeah

Let the music take your mind
Just release and you will find

You're gonna fly away
Glad you're going my way
I love it when we're cruisin' together
The music is played for love
Cruisin' is made for love
I love it when we're cruisin' together

(Cruise with me baby
Cruise with me baby
Cruise), hooh-hooh, yeah, oh baby
(Cruise), ow, ow
So good to cruise with you, baby
So good to cruise with you, baby
Ow, yeah
You need, baby

Baby let's cruise, let's flow, let's glide
Ooh, let's open up and go inside
And if you want it, you got it forever
I can just stay there inside you
And love you baby

Let the music, take your mind
Just release and you will find

You're gonna fly away
Yeah, I'm glad you're going my way
I love it when we're cruisin' together
The music is... oh!
Cruisin' is made for love
I love it when we're cruisin' together

Oh, baby (We're gonna fly away)
Oh, baby (Glad you're going my way)
I love it when we're cruisin' together
The music is... oh!
Cruisin' is made for love
I love it, I love it, I love it, I love it
(We're gonna fly away), yeah
(Glad you're going my way)
I love it, when we're cruisin' together
The music is played for love
Cruisin' is made for...
I love it, I love it, I love it, I love it
I love it (We're gonna fly away)
(Glad you're going my way)
I love it when we're cruisin' together","soul, motown, rhythm and blues, 60s, oldies"
13,14,"""Working My Way Back to You/Forgive Me, Girl""",The Spinners,,"soul, motown, funk, 70s, oldies"
14,15,"""Lost in Love""",Air Supply,"19 ContributorsLost in Love LyricsThe original version of “Lost in Love” appeared on the Life Support album in 1979 and reached #3 in New Zealand and #13 in Australia.
Music industry legend Clive Davis heard the song and signed the band to… Read More 
On

I realise the best part of love is the thinnest slice
And you don't get for much
But I'm not letting go
I believe there's still much to believe in

So lift your eyes if you feel you can
Reach for a star and I'll show you a plan
I figured it out
What I needed was someone to show me

You know you can't fool me
I've been lovin' you too long
It started so easy
You want to carry on (Carry on)

Lost in love and I don't know much
Was I thinkin' aloud and fell out of touch?
But I'm back on my feet
And eager to be what you wanted

So lift your eyes if you feel you can (Feel you can)
Reach for a star and I'll show you a plan (Show you a plan)
I figured it out
What I needed was someone to show me (Oh, oh)

You know you can't fool me
I've been lovin' you too long (I've been love too long)
It started so easy
You want to carry on (Carry on)

Lost in love and I don't know much
Was I thinkin' aloud and fell out of touch?
But I'm back on my feet
And eager to be what you wanted

You know you can't fool me
I've been lovin' you too long (I've been here too long)
It started so easy
You want to carry on (Carry on, carry on, carry on)

Lost in love and I don't know much
Was I thinkin' aloud, fell out of touch?
But I'm back on my feet
Eager to be what you wanted

Now I'm lost (Lost in love and I don't know much)
Lost in love (Was I thinkin' aloud, you out of touch?)
Lost in love (But I'm back on my feet)
Lost in love (And eager to be what you wanted)
Now I'm lost (Lost in love and I don't know much)
I'm in love (Was I thinkin' aloud, you out of touch?)
I'm lost in love (But I'm back on my feet)
Lost in love (And eager to be what you wanted)","80s, soft rock, pop, classic rock, rock"
15,16,"""Little Jeannie""",Elton John,"14 ContributorsLittle Jeannie Lyrics“Little Jeannie” was written by Elton John and Gary Osborne. Osborne wrote the lyrics about someone specific, not named Jeannie, and has chosen not to reveal who that person is.
In summer 1980 it reached the… Read More 
Oh, little Jeannie
You got so much love, little Jeannie
And you take it where it strikes
And give it to the likes of me
Oh, little Jeannie
You got so much love, little Jeannie
So I see you when I can
You make me all a man can be

And I want you to be my acrobat
I want you to be my lover
Oh, there were others who would treat you cruel
And oh, Jeannie, you were always someone's fool

Little Jeannie
You got so much time, little Jeannie
Though you've grown beyond your years
You still retain the fears of youth
Oh, little Jeannie
You got so much time, little Jeannie
But you're burnin' it up so fast
Searchin' for some lasting truth

And I want you to be my acrobat
I want you to be my lover
Oh, there were others who would treat you cruel
But oh, Jeannie, I will always be your fool


And I want you to be my acrobat
I want you to be my lover
Oh, there were others, and I've known quite a few
But oh, Jeannie, I'm still in love with you

You stepped into my life from a bad dream
Makin' the life that I had seem suddenly shiny and new
Oh, Jeannie, (Oh, Jeannie) I'm so in love with you
You stepped into my life from a bad dream
Makin' the life that I had seem suddenly shiny and new
Oh, Jeannie, (Oh, Jeannie) I'm so in love with you
You stepped into my life from a bad dream
Makin' the life that I had seem suddenly shiny and new
Oh, Jeannie, (Oh, Jeannie) I'm so in love with you
You stepped into my life from a bad dream
Makin' the life that I had seem suddenly shiny and new
Oh, Jeannie, (Oh, Jeannie) I'm so in love, I'm so in love
You stepped into my life from a bad dream
Makin' the life that I had seem suddenly shiny and new
Oh, Jeannie, (Oh, Jeannie) I'm so in love, I'm so in love","pop, classic rock, singer-songwriter, rock, piano"
