Unnamed: 0,No.,Title,Artist(s),lyrics,genres
66,67,"""If It Isn't Love""",New Edition,"30 ContributorsIf It Isn’t Love Lyrics“If It Isn’t Love” was the first single from the classic 1988 album Heart Break. The single peaked at #7 on the Billboard Hot 100 and reached #2 on the Billboard Hot R&B/Hip-Hop chart as they were ironically… Read More 
I don't love her
I tried to tell myself
But you can see it in my eyes
So don't deny
I can't fool no one else
The truth is in the tears I cry
'Cause...

If it isn't love
Why do I feel this way?
Why does she stay on my mind?
If it isn't love
Why does it hurt so bad?
Make me feel so sad inside
If it isn't love

I told her I'd never fall in love
But now I know better

How does it feel
I can't describe this feeling
That came when I saw her last night
She got to me
I'll let you know the reason
I saw her with another guy
So...

If it isn't love
Why do I feel this way?
Why does she stay on my mind?
And if it isn't love
Why does it hurt so bad?
Make me feel so sad inside
If it isn't love

Maybe she'll take me back
(Hey, girl, he's begging)
I made a big mistake
(Won't you forgive him, girl)
Now I can feel it
(He's never felt before)
I really love her
(You love her?!?! What?!?!)

It took my heart
To shatter in a thousand pieces
Before I'd ever drop my pride
(Oh, oh, oh, oh)
Losing love worrying about my image
Really helped me realize

If it isn't love
Why do I feel this way?
(Why does it hurt so bad?)
Why does she stay on my mind?
(On my mind all the time)
If it isn't love
Why does it hurt so bad?
(If it isn't love)
Make me feel so sad inside
(If it isn't love)
If it isn't love
If it isn't love
(Woo)
Why do I feel this way?
(Why?)
Why does she stay on my mind?
(She stays on my mind, mind, mind)
If it isn't love
Why does it hurt so bad?
(Why does it hurt so bad?)
Make me feel so sad inside
(Why?)
If it isn't love
(If it isn't love)
Why do I feel this way?
(If it isn't love)
Why does she stay on my mind?
(If it isn't love)
If it isn't love
Why does it hurt so bad?
(If it isn't love)
Make me feel so sad inside
(If it isn't, I can't describe this feeling that I feel for her)
If it isn't love
Why do I feel this way?
Why does she stay on my mind?
(Stay on my mind)
If it isn't love
Why does it hurt so bad?
Make me feel so sad inside

If it isn't love
If it isn't love","rnb, 80s, soul, new jack swing, pop"
67,68,"""Rocket 2 U""",The Jets,"4 ContributorsRocket 2 U LyricsRocket 2 U peaked at #6 on the Billboard Hot 100 and #5 on Billboard’s R&B chart.
Baby, baby
When I called you on the phone today
You sounded frantic when you said
Come over right away
Oh, baby, baby
Won't you say what's on your mind?
Your TV set is acting up
And you don't understand
You're so upset
Because you can't watch All My Children
And you wonder
If there's something I can do for you
Well
All that I can say

Baby
I can rocket 2 u
Honey, the only thing I can do
Baby
I can rocket all night
One thing I know I can do

Don't call me when your car
Just can't get into second gear
Or when your kitchen sink
Is shooting water in your ear
Oh, baby, baby
I have told you this before
Is there a special reason
That you just can't understand
I'm not the one to call
When you need a heavy man
Unless whatever needs fixing, girl
Is you
And I just have to say


Don't call me
When your toaster won't pop up
Don't call me
Just to cut your lawn
Don't call me
When your radio cuts off
In the middle of your favorite song

Don't call me when your shower just went
Uh-uh, no, baby
Don't call me
I think I told you this
About a million times
You know, it's not my cup of tea

I can rocket 2 u
The only thing I can do
I can rocket all night
I can rocket 2 u, baby
Let me rocket 2 ya, oh yeah
Just a little bit more
Baby, I can rocket 2 u
Honey, the only thing I can do
Baby, I can rocket all night
One thing I know I can do
Baby, I can rocket 2 u
Honey, the only thing I can do
Baby, I can rocket all night
One thing I know I can do

Baby, I can rocket 2 u
Honey, the only thing I can do
Baby, I can rocket all night
One thing I know I can do","80s, pop, dance, Disco, rockabilly"
68,69,"""One Good Woman""",Peter Cetera,"3 ContributorsOne Good Woman Lyrics
I am so in love with you
I just can't deny it
Everybody knows I can't deny it
Everybody knows

You can read me like a book
Just like a fortune teller
Everybody needs a fortune teller
Telling you the very truth

You bring me feelin'
You bring me fire
You give me a love that's taking me higher
Just goes to prove
What one good woman can do

You bring out the best in me
With love and understanding
Anytime I need some understanding
You are always there

And if I ever lose my way
You're always there to guide me
Anyone can see you're here inside me
Anyone can see it

You bring me feelin'
You bring me fire
You give me a love that's taking me higher
Just goes to prove
What one good woman can do

You fill me with hope
Love and devotion
You taught me how to show my emotion
Just goes to prove
What one good woman can do

This is our time, we have it all
We have a way of knowing if we're heading for a fall
But we'll work it out and get it right
And when I get home to you
You're such a sight for my poor eyes


This is our time, we have it all
When I come home at night
You're such a sight for my poor eyes

You bring me feelin'
You bring me fire (You bring me fire)
You give me a love that's taking me higher (Taking me higher)
Just goes to prove
What one good woman can do (One good woman)

You fill me with hope
Love and devotion
You taught me how to show my emotion
Just goes to prove
What one good woman can do (Just goes to prove, what one good woman)

You bring me feelin'
You bring me fire (You bring me fire)
You give me a love that's taking me higher (Taking me higher)
Just goes to prove
What one good woman can do (One good woman)

You fill me with hope
Love and devotion
You taught me how to show my emotion
Just goes to prove
What one good woman can do (Just goes to prove, what one good woman)","80s, pop, classic rock, rock, adult contemporary"
69,70,"""Don't Be Cruel""",Cheap Trick,"7 ContributorsDon’t Be Cruel LyricsWell you know I can be found
Sitting all alone
If you can't come around
At least please telephone
But don't be cruel
To a heart that's true
Baby, if I made you mad
For something I might have said
Please forget the past
The future's bright ahead
But don't be cruel
To a heart that's true
I don't want no other love
Baby, it's just you I'm thinkin' of
Don't stop thinkin' of me
Don't make me feel this way
Come on over and love me
You know I want you to stay
But don't be cruel
To a heart that's true
Let's walk down to the preacher
Let's say ""Hey, I do""
And then I know you'll want me
And you'll know I want you too

But don't be cruel
To a heart that's true
I don't want no other love
Baby, it's just you I'm thinkin' of
Don't be cruel
To a heart that's true
Don't be cruel
To a heart that's true
Don't need no other love
Baby, it's just you I'm thinkin' of
Don't stop thinkin' of me
Don't make me feel this way
Come on over and love me
You know I want you to stay
But don't be cruel
To a heart that's true
Why should we be apart?
Baby, you know I love you, cross my heart
Don't be cruel
To a heart that's true
Don't be cruel
To a heart that's true
Don't be cruel
To a heart that's true
Don't be cruel
To a heart that's true
Don't want no other love
Baby, it's just you I'm thinkin' of","classic rock, rock, power pop, hard rock, 80s"
70,71,"""Candle in the Wind""",Elton John,"54 ContributorsCandle in the Wind LyricsThe second track on Elton John’s 1973 double album Goodbye Yellow Brick Road. Written by Elton and his fellow co-songwriter Bernie Taupin, “Candle in the Wind” focuses on the life of Norma Jeane, AKA Marilyn… Read More 
Goodbye, Norma Jeane
Though I never knew you at all
You had the grace to hold yourself
While those around you crawled
They crawled out of the woodwork
And they whispered into your brain
They set you on the treadmill
And they made you change your name

And it seems to me you lived your life
Like a candle in the wind
Never knowing who to cling to
When the rain set in
And I would've liked to know you
But I was just a kid
Your candle burned out long before
Your legend ever did

Loneliness was tough
The toughest role you ever played
Hollywood created a superstar
And pain was the price you paid
Even when you died
Oh, the press still hounded you
All the papers had to say
Was that Marilyn was found in the nude

And it seems to me you lived your life
Like a candle in the wind
Never knowing who to cling to
When the rain set in
And I would've liked to know you
But I was just a kid
Your candle burned out long before
Your legend ever did

Goodbye, Norma Jeane
Though I never knew you at all
You had the grace to hold yourself
While those around you crawled
Goodbye, Norma Jeane
From the young man in the twenty-second row
Who sees you as something more than sexual
More than just our Marilyn Monroe

And it seems to me you lived your life
Like a candle in the wind
Never knowing who to cling to
When the rain set in
And I would've liked to know you
But I was just a kid
Your candle burned out long before
Your legend ever did

Your candle burned out long before
Your legend ever did","pop, classic rock, singer-songwriter, rock, piano"
71,72,"""Everything Your Heart Desires""",Daryl Hall & John Oates,"5 ContributorsEverything Your Heart Desires LyricsYou say you can't stand to be tied so close to a lover
Ooh, you feel like a prisoner
And you wanna find someone who will let you out
Can't you see the heartbeat that you know so well
Is better than some strange one you're looking for
Say, you never know that strange one
Just might be me, yeah
Can't you see you have everything your heart desires
So why you want more?
If you have (if you have), everything your heart desired
Would you still want more?
You have everything your heart desires
Why do you want more?
(If you have)
Everything your heart desires
Would you still want more?
You tell me your best friend's world seem beautiful
But don't be fooled
It's nice work if you can get it
Yeah, what goes on behind closed doors you don't know
Maybe she cries herself to sleep every night
Sorry that the heartbeat that she knows so well
Ain't what she's looking for
You never know that strange heart
Just might be me

Baby, you have everything your heart desires
So why you want more?
If you have (if you have), everything your heart desired
Would you still want more?
You have, oh, everything your heart desires
Why do you want more?
(If you have)
Everything your heart desires
Would you still want more?
Maybe you'll confess; girl, you'll see
If you want the world, if you want the world, think of me
No words can help, so don't be sad, oh no
'Cause baby, what you want is what you have
Yeah, hey...
Do you still want me?
(You have everything your heart desires)
Everything your heart desires
So why you want more?
(If you have everything your heart desires)
I can give you anything you want
(You have everything your heart desires)
As long as you know, I got what you need
You got the key, ooh baby
(If you have everything your heart desired)
I ain't gonna let you go
No no, no no, no no, no no, no no, no no, no no...
(You had everything your heart desired...)","80s, pop, soft rock, classic rock, rock"
72,73,"""Say You Will""",Foreigner,"10 ContributorsSay You Will Lyrics
Say you will, say you won't
Make up your mind tonight
Say you do, say you don't
Want to be mine
Say you will, say you won't
Make up your mind this time
Say you will, say you won't
Be mine tonight

I can't sleep I keep dreaming I'm losing you
Feel so alone in the night, scared to open my eyes
I'm in too deep, I'm in over my head this time
Can't get you out of my mind no matter how hard I try
So won't you...

Say you will, say you won't
Make up your mind tonight
Say you do, say you won't
Be my guiding light
Say you will, say you won't
Make up your mind tonight
Say you do, say you don't
Want to be mine

I get the feeling I've never been here before
Because no one I've known's ever moved me the way
That you do
And I know this is the real thing
It's all I've been searching for
I've put it all on the line now I'm hoping you feel
That way too
(And if you do) Why don't you...

Say you will, say you won't
Make up your mind tonight
Say you do, say you don't
Want to be mine
Now will you, say you will, you say you won't
Make up your mind this time
Say you will, say you will
You'll be mine tonight

Will you tell me how much I mean to you
Will you say you always will be true
I need more than a come-on sign
So won't you say you will be mine

Now won't you, say you will, say you won't
Make up your mind tonight
Say you will, say you will
Be my guiding light
Say you will, say you won't
Make up your mind tonight
Say you do, say you don't
Want to be mine

Come on come on
Say you will make up your mind tonight
Say you will, say you will
Be mine tonight","classic rock, rock, hard rock, 80s, pop"
73,74,"""I Want Her""",Keith Sweat,"9 ContributorsI Want Her Lyrics“I Want Her” is Keith Sweat’s first single ever, and a track that quickly solidified him into the R&B artist he is today.
Initially, Keith and co-producer Teddy Riley collaborated on this track because Sweat… Read More 
Seen you last night, saw you standing there
And couldn't picture the color of your hair
And all I wanted to know, were you really there?
I wanna know, was it my imagination?
Ooh, you know it was a sweet sensation
Looking at you from a distance
Ooh, it seems so real

You and I together
Dream that seemed for real
If it's a dream, please don't wake me up
It feels so real, all I know is

I want her
(I want that baby)
I want her
(Get it, get it, get it, get it)
I want her
(I wanna do it like this, do it like that)
I want her
(Once I get it, ain't no turning back)

You turn me on and on
This feeling, girl, is so strong
My heart, girl, is on fire
Ooh, you're my desire

I've got a thing for you
Dreams of you and me, baby
She's bad, she's bad, she's bad
All I know is

I want her
(I want, I want, I want, I want, I want her)
I want her
(Don't misunderstand me)
I want her
(I wish this dream was for real)
I want her
(You, you know the deal)
I want her
(Yeah, yeah)
I want her
(I want that girl so bad)
I want her
(I had a dream of her last night)
I want her
(Yeah, yeah, yeah)


And I, I
Give it to me, give it to me
Give it to me, ooh, baby
All night long, girl

I want her
(Ooh, baby)
I want her
(I want that girl so bad)
I want her
(All night long)
I want her
(Let me tell you something, I wanna do it like this, baby)
I want her
(I wanna do it like that, sugar)
I want her
(You know what I need, girl
You know what I like, girl)
I want her
(Like this, baby)
I want her
(I wanna do it like that, sugar)
I want her
(You turn me on and on and on and on, baby)
I want her
(I wanna do it like this, baby
I wanna do it like that, sugar)
I want her
(You know what I mean, girl
You know what I like, girl)
I want her
(I wanna do it like this, baby
I wanna do it like that, sugar)
I want her
(Ooh, I want you so bad, girl)

I want her
(I need you right now, baby)
I want her
(Give it to me, give it to me all night long, girl
I just want you so bad, girl)
I want her
(I just need you so bad, girl
Come on, girl, come on, girl)
I want her
I want her
I want her
(Baby)
I want her
(Don't let this be a dream, girl)
I want her
(I want you so bad, ooh baby)
I want her
(Give it to me tonight, girl)
I want her
(Love me, love me, love me, love me, love me down)
I want her
I want her
I want her
(This feeling, girl, is so so so so so so
I want you so bad, baby
Was it a dream last night, girl?)","rnb, soul, slow jams, new jack swing, 90s"
74,75,"""Pink Cadillac""",Natalie Cole,"11 ContributorsPink Cadillac Lyrics
You may think I'm fooling
For the foolish things I do
You may wonder how come I love you
When you get on my nerves like you do
Well, baby, you know you bug me
There ain't no secret about that
Well, come on over here and hug me
Baby, I'll spill the facts

Well, honey it ain't your money
'Cause I got plenty of that

I love you for your pink Cadillac
Crushed velvet seats
Riding in the back, oozing down the street
Waving to the girls, peeling out of sight
Spending all my money on a Saturday night
Honey, I just wonder what you do there in the back
Of your pink Cadillac
Pink Cadillac

Well now, way back in the Bible
Temptations always come along
There's always somebody tempting you
Into doing something they know is wrong
Well, they tempt you, ma'am, with silver
And they tempt you, sir, with gold
And they tempt you with the pleasures
That flesh does surely hold

They said Eve tempted Adam with an apple
Man, I ain't going for that

I know it was her pink Cadillac
Crushed velvet seats
Riding in the back, oozing down the street
Waving to the girls, peeling out of sight
Spending all my money on a Saturday night
Honey, I just wonder what you're doing in the back
Of your pink Cadillac
Pink Cadillac, yeah

Now, now, now, now, some folks say it's too big
And uses too much gas
Some folks say that it's too old
And that it just goes too fast
Oh, but love is bigger than a Honda (Honda)
And it's bigger than a Subaru (That too)
Hey man, there's only one thing
And one car that will do
Anyway we don't have to drive it
Honey, we can park it out in back
And have a party in your

Pink Cadillac
Crushed velvet seats
Riding in the back, oozing down the street
Waving to the girls, peeling out of sight
Spending all my money on a Saturday night
Honey, I just wonder what you do there in the back
Of your pink Cadillac

You know the one I mean, Le Car
Oh, oh, oh, Cadillac
In the dark, can't do that
When we park in the back of your pink Cadillac (Uh-uh)
Oh, I like what you do when do what you do in your pink
Pretty, pretty, pretty pink Cadillac
In the dark, can't do that
In the back of your pink Cadillac","jazz, female vocalists, soul, vocal jazz, blues"
75,76,"""Fast Car""",Tracy Chapman,"135 ContributorsTranslationsFrançaisEspañolDeutschFast Car Lyrics“Fast Car” is a song by American singer-songwriter Tracy Chapman. It was released in April 1988 as the lead single from her self-titled debut album. Her appearance on the Nelson Mandela 70th Birthday Tribute… Read More 
You got a fast car
I want a ticket to anywhere
Maybe we make a deal
Maybe together we can get somewhere
Any place is better
Starting from zero, got nothing to lose
Maybe we'll make somethin'
Me, myself, I got nothing to prove

You got a fast car
I got a plan to get us outta here
I been working at the convenience store
Managed to save just a little bit of money
Won't have to drive too far
Just across the border and into the city
You and I can both get jobs
Finally see what it means to be living

See, my old man's got a problem
He lives with a bottle, that's the way it is
He says his body's too old for workin'
His body's too young to look like his
When mama went off and left him
She wanted more from life than he could give
I said, ""Somebody's gotta take care of him""
I quit school and that's what I did

You got a fast car
Is it fast enough so we can fly away?
We gotta make a decision
Leave tonight or live and die this way
So I remember when we were drivin', drivin' in your car
Speed so fast, I felt like I was drunk
City lights lay out before us
And your arm felt nice wrapped 'round my shoulder
And I had a feeling that I belonged
I had a feelin' I could be someone
Be someone, be someone

You got a fast car
We go cruisin', entertain ourselves
You still ain't got a job
And I work in a market as a checkout girl
I know things will get better
You'll find work and I'll get promoted
And we'll move out of the shelter
Buy a bigger house and live in the suburbs
So I remember when we were drivin', drivin' in your car
Speed so fast, I felt like I was drunk
City lights lay out before us
And your arm felt nice wrapped 'round my shoulder
And I had a feeling that I belonged
I had a feelin' I could be someone
Be someone, be someone

You got a fast car
I got a job that pays all our bills
You stay out drinkin' late at the bar
See more of your friends than you do of your kids
I'd always hoped for better
Thought maybe together, you and me'd find it
I got no plans, I ain't going nowhere
So take your fast car and keep on drivin'

So I remember when we were drivin', drivin' in your car
Speed so fast, I felt like I was drunk
City lights lay out before us
And your arm felt nice wrapped 'round my shoulder
And I had a feeling that I belonged
I had a feelin' I could be someone
Be someone, be someone

You got a fast car
Is it fast enough so you can fly away?
You gotta make a decision
Leave tonight or live and die this way","female vocalists, folk, singer-songwriter, soul, acoustic"
76,77,"""Electric Blue""",Icehouse,"12 ContributorsElectric Blue Lyrics
If a boy had a chance
A chance with someone like you
Are you gonna break his heart?
Let him cry for the moon?

Are you hiding somewhere behind those eyes?

(I just freeze) I just freeze
Every time you see through me
And it's all over you
Electric blue
(On my knees) On my knees
Help me, baby
Tell me, what can I do?
Electric blue

Oh, I had a dream
For a moment, I believed it was true
Oh, I'd have given anything
Just to be there with you

Are you hiding somewhere behind those eyes?

(I just freeze) I just freeze
Every time you see through me
And it's all over you
Electric blue
(In too deep) In too deep
Standin' here waitin'
As I'm breakin' in two
Electric blue
(I can see) I can see
Can see that it may be
Just a vision of you
Electric blue
(On my knees) On my knees
Help me, baby
Tell me, what can I do?
Electric blue

(Help me, baby!)

Are you hiding somewhere behind those eyes?

(In those eyes) I just freeze
Every time you see through me
And it's all over you
Electric blue
(In too deep) In too deep
Standin' here waitin'
As I'm breakin' in two
Electric blue
(I can see) I can see
Can see that it may be
Just a vision of you
Electric blue
(On my knees) On my knees
Help me, baby
Tell me, what can I do?
Electric blue
(In those eyes) I just freeze
Every time you see through me
And it's all over you
Electric blue
(In too deep) In too deep
Standin' here waitin'
As I'm breakin' in two
Electric blue
(I can see) I can see
Can see that it may be
Just a vision of you
Electric blue
(On my knees) On my knees
Help me, baby
Tell me, what can I do?
Electric blue

Mmmm
Electric blue
Electric blue
Electric blue
Electric blue","new wave, 80s, australian, pop, rock"
77,78,"""The Valley Road""",Bruce Hornsby and the Range,"9 ContributorsThe Valley Road Lyrics“The Valley Road”  is the second track and first single from 1988’s Scenes From the Southside.
Like many songs by the band, it’s socio-political in nature and details a scenario that Hornsby found all too… Read More Sometimes I lead, sometimes I follow
This time I'll go where she wants me to go
She said maybe today, maybe tomorrow
Deep in the woods down the low valley road
While no one was lookin' on the old plantation
He took her all the way down the long valley road
They sent her away not too much later
And left him walking down the old valley road
Walk on
Walk on, walk on alone
Walk on, walk on
Walk on alone, alone
Out in the hall, they were talking in a whisper
Everybody noticed she was gone awhile
Somebody said she's gone to her sister's
Everybody knew what they were talking about
Whoa, while no one was lookin' on the old plantation
He showed her what they do down the long valley road
She came back around like nothing really happened
And left him standing on the old valley road
Walk on
Walk on, walk on alone
Walk on, walk on
Walk on, walk on, on the valley road

Standing like a stone on the old plantation
The rich old man would have never let him in
Good enough to hire, not good enough to marry
When it all happens, nobody wins
Walk on
Walk on, walk on alone
Walk on, walk on
Walk on, walk on alone, alone","80s, classic rock, rock, singer-songwriter, pop"
