Unnamed: 0,No.,Title,Artist(s),lyrics,genres
68,69,"""Efecto""",Bad Bunny,"38 ContributorsTranslationsEnglishDeutschItalianoEfecto Lyrics

Yeah-yeah-yeah-yeah-yeah-yeah
Eh-eh-eh-eh

No sé si es casualidad que yo me sienta así
Siempre que tú estás cerquita de mí
Dime qué me hiciste, qué droga me diste
Que desde aquella noche no soy igual
Tú me mira' y empiezo a sudar
Siento que puedo volar

Baby, la nota ya está haciendo efecto
Mi mundo está jodío' y me siento perfecto
Porque estás tú, aquí, moviéndote así, no pare'
Baby, tú eres mi droga, esta noche no le baje'
Porque la nota ya está haciendo efecto
Mi mundo está jodío' y me siento perfecto
Porque estás tú, aquí, moviéndote así, no pare'
Baby, tú eres mi droga, esta noche no le baje'

Esta no, esta sí
Esta no, esta sí
Esta no, esta sí
Esta no, esta sí

El gatito tuyo te perdió por negligencia
Y yo que no creo en la abstinencia
Esta noche en la cama va a haber turbulencia'
Qué rico tú mama', te vo'a dar la permanencia'
Ese totito e' la eminencia
Pa' darle tengo licencia
Desde que fuimo' a Florencia
Se puso más bicha, pero no pierde la esencia
No, no, de Carola
No, no, no, no anda sola
No, no, no le diga' ""hola""
O va' a ser otro pa' la cola
Tu piquete me mola
Yo soy fan de esa popola (Mua, mua)
Más las picky, las endo, la coca y la rola (Más nada)
Eres tú quien me controla, eh (Jeje)

En tus ojo' veo el mar, mami, llévame en tu ola (Tú eres mala)
Hoy me siento bien puta, re piola, ey

Porque la nota ya está haciendo efecto
Mi mundo está jodío' y me siento perfecto
Porque estás tú, aquí, moviéndote así, no pare'
Baby, tú ere' mi droga, esta noche no le baje'","Reggaeton, latin, trap, puerto rico, rap"
69,70,"""Rock and a Hard Place""",Bailey Zimmerman,"18 ContributorsRock and A Hard Place Lyrics
We've been swingin’ and missin'
It ain't broke yet, but damn, it needs fixin’
Been a while since your kiss felt like kissin'
It's just different

We've been talkin' 'bout forever since we been together
Somethin' 'bout a ring makes you think we’re better
Off with all this, but we’re caught in-between

A rock and a hard place
Red wine and mistakes
Tears rollin' down your face
When I walked out that door
That’s when I lost it
Midnight in Austin
Damn, I'm exhausted
What the hell's this all for?
Is this where it mеnds or it breaks?
Between a rock and a hard place

For thе record (Shit)
Throwin' in the towel takes some effort
So I’d rather ride it out for better weather
Together

Between a rock and a hard place
Red wine and mistakes
Tears rollin' down your face
When I walked out that door
That's when I lost it
Midnight in Austin
Damn, I'm exhausted
What the hell's this all for?
Is this where it mends or it breaks?
Between a rock and a hard place

We've been talkin' 'bout forever since we been together
Somethin' 'bout a ring makes you think we're better
Off with all this, but we're caught in-between

A rock and a hard place
Tears rollin' down your face
As I walked out that door
That's when I lost it
Midnight in Austin
Damn, I'm exhausted
What the hell's this all for?
Is this where it mends or it breaks?
How much more of this can we take?","country, contemporary country, singer-songwriter, rock, USA"
70,71,"""Doin' This""",Luke Combs,"9 ContributorsDoin’ This Lyrics
Someone asked me once in an interview
""What was growing up like?""
""Where'd you go to school?""
""And what would you do if you weren't doin' this?""
I'd be drivin' my first car, an old worn-out Dodge
Tryin' to make rent with a dead-end job, just makin' due
With tips in a jar, my guitar, and an old barstool

I'd have a Friday night crowd in the palm of my hand
Cup of brown liquor, couple buddies in a band
Singin' them same damn songs like I am now
I'd be feelin' on fire on a hardwood stage
Bright lights like lightning runnin' through my veins
At the Grand Ole Opry or a show in some no-name town
I'd still be doin' this if I weren't doin' this

I'd still be the same guy they knew back in the day
Who was burnin' CD's just to give away
Payin' his dues
If I wasn't doin' this
Five deep in a van, head full of steam
Hot on the heels of my neon dreams maybe comin' true
Livin' this life just like I was born to do

I'd have a Friday night crowd in the palm of my hand
Cup of brown liquor, couple buddies in a band
Singin' them same damn songs like I am now
I'd be feelin' on fire on a hardwood stage
Bright lights like lightning runnin' through my veins
At the Grand Ole Opry or a show in some no-name town
I'd still be doin' this if I weren't doin' this

It ain't about the fame
It ain't about the fortune
It ain't about the name
It ain't about the glory
I guess I'm sayin' it's always been about

I'd have a Friday night crowd in the palm of my hand
Cup of brown liquor, couple buddies in a band
Singin' them same damn songs like I am now
I'd be feelin' on fire on a hardwood stage
Bright lights like lightning runnin' through my veins
At the Grand Ole Opry or a show in some no-name town
I'd still be doin' this if I weren't doin' this

Someone asked me once in an interview
""What was growing up like?""
""Where'd you go to school?""
""And what would you do if you weren't doin' this?""","country, country pop, contemporary country, country rock, americana"
71,72,"""Oh My God""",Adele,"68 ContributorsTranslationsTürkçeEspañolРусский (Russian)PortuguêsDeutschPolskiFilipinoفارسیFrançaissrpskiOh My God Lyrics“Oh My God” explores Adele wanting to put herself first but having internal conflicts about it. Following the previous track, “Oh My God” finds Adele taking control of her life after a depressive episode in… Read More 
I ain't got too much time to spare
But I'll make time for you to show how much I care
Wish that I would let you break my walls
But I'm still spinning out of control from the fall
Boy, you give good love, I won't lie
It's what keeps me comin' back even though I'm terrified

I know that it's wrong
But I want to have fun
Mmm, yeah, mmm, yeah
I know that it's wrong
But I want to have fun
Mmm, yeah, mmm, yeah

Oh, my God, I can't believe it
Out of all the people in the world
What is the likelihood of jumping
Out of my life and into your arms?
Maybe, baby, I'm just losing my mind
'Cause this is trouble, but it feels right
Teetering on the edge of Heaven and Hell
Is a battle that I cannot fight

I'm a fool, but they all think I'm blind
I'd rather be a fool than leave myself behind
I don't have to explain myself to you
I am a grown woman and I do what I want to do

I know that it's wrong
But I want to have fun
Mmm, yeah, mmm, yeah
I know that it's wrong
But I want to have fun
Mmm, yeah, mmm, yeah

Oh, my God, I can't believe it
Out of all the people in the world
What is the likelihood of jumping
Out of my life and into your arms?
Maybe, baby, I'm just losing my mind
'Cause this is trouble, but it feels right
Teetering on the edge of Heaven and Hell
Is a battle that I cannot fight

""Lord, don't let me,"" I said, ""Lord, don't let me""
I said, ""Lord, don't let me, let me down"" (Oh, Lord)
""Lord, don't let me,"" I said, ""Lord, don't let me""
I said, ""Lord, don't let me, let me down"" (Don't let me let myself down)
""Lord, don't let me,"" I said, ""Lord, don't let me""
I said, ""Lord, don't let me, let me down"" (Oh, my God)
""Lord, don't let me,"" I said, ""Lord, don't let me""
I said, ""Lord, don't let me, let me down"" (Oh, oh-oh-oh, oh-oh-oh)

Oh, my God, I can't believe it
Out of all the people in the world
What is the likelihood of jumping
Out of my life and into your arms?
Maybe, baby, I'm just losing my mind
'Cause this is trouble, but it feels right
Teetering on the edge of Heaven and Hell
When it's a battle that I cannot fight

""Lord, don't let me,"" I said, ""Lord, don't let me""
I said, ""Lord, don't let me, let me down"" (I know that it's wrong, but I want to have fun)
""Lord, don't let me,"" I said, ""Lord, don't let me""
I said, ""Lord, don't let me, let me down"" (Mmm, yeah, mmm, yeah)
""Lord, don't let me,"" I said, ""Lord, don't let me""
I said, ""Lord, don't let me, let me down"" (I know that it's wrong, but I want to have fun)
""Lord, don't let me,"" I said, ""Lord, don't let me""
I said, ""Lord, don't let me, let me down"" (Mmm, yeah, mmm, yeah)","soul, female vocalists, british, singer-songwriter, indie"
72,73,"""Better Days""","Neiked, Mae Muller and Polo G","52 ContributorsBetter Days LyricsThe Swedish producer NEIKED recruits rap icon Polo G and the up-coming singer Mae Muller for “Better Days,” a funk-influenced song conveying love, affection, and trust in a relationship.
The song has been… Read More 
I've been feelin' lonely
I need someone to hold me
Come on, baby, hold me
Yeah, I've been feelin' jaded
Don't know how I should play it
Tell me how to play it

Now you, you've been movin' on
Let me know, can I come along?
Since you're gone, oh, it's been so long
On my own, my own, my own, my own

Livin' in a haze, stayin' in the shade
All I do is sit around and wait for better days
I could use a break, can I get an ""amen""?
All I do is sit around and wait for better days

Uh, uh
Can I get a ""amen""? Introverted, can't make friends
Pray for better days, now it's three hundred K when my day ends
Do you remember last night? 'Cause I blacked out
In that all white dress with her back out
Said be careful with her heart 'cause it's fragile
And thinkin' 'bout her past make her lash out
See, with me, it ain't no worries at all
Any problem, I'll be there, one call
If we locked in, you my dawg
Fan of you, I hang pictures on my wall
Roll one, let's get high tonight
Backseat, Maybach, lavish life
Chillin' with the stars like a satellite
AP on my arm and it's shinin' bright, uh

Livin' in a haze (Haze), stayin' in the shade (The shade)
All I do is sit around and wait for better days (Oh, I sit around and wait)
I could use a break, can I get an ""amen""? (Amen)
All I do is sit around and wait for better days

Sit around, sit around, sit around and wait
For better, better, better days, oh
I could use a break, oh
Better, better, better, better
For better days, no, no

Oh no, no, no
All I do is sit around and wait for better days
Better days
All I do is sit around and wait for better days, no, no",
73,74,"""Meet Me at Our Spot""",The Anxiety: Willow and Tyler Cole,"50 ContributorsTranslationsDeutschMeet Me At Our Spot Lyrics
When I wake up, I can't even stay up
I slept through the day, fuck
I'm not getting younger
But when I'm older, I'll be so much stronger
I'll stay up for longer
Meet me at our spot

Caught a vibe (Woo, woo)
Baby, are you coming for the ride? (The ride, the ride, the ride)
I just wanna look into your eyes (Your eyes, your eyes)
I just wanna stay for the night, night, night
When we take a drive (Woo, woo)
Maybe we can hit the 405
Hypnotized by the lights
Man, this must be the life

When I go to sleep, I can't even fall asleep
Something's got ahold of me
Feel it taking over me
But when I'm older I'll be moving onward
I just got a drunk text
(Meet me at our spot)

We caught a vibe (Yeah, yeah)
Baby, are you coming for the ride? (The ride, the ride, the ride)
When I look into your eyes (Your eyes, your eyes)
I just wanna hold you all night (All night)
Maybe we can take a drive (Take a drive)
Baby, we can hit the 405
Hypnotized by the lights
Man, this must be the life

Meet me at our spot
Got something I wanna show you
Meet me at our spot
They can't find us there
Meet me at our spot
Got something I wanna show you
Meet me at our spot
They can't find us there

Caught a vibe (Woo, woo)
Baby, are you coming for the ride? (The ride, the ride, the ride)
I just wanna look into your eyes (Into your eyes)
I just wanna stay for the night, night, night
When we take a drive (Woo, woo)
Maybe we can hit the 405
Hypnotized by the lights
Man, this must be the life",
74,75,"""Fingers Crossed""",Lauren Spencer-Smith,"47 ContributorsTranslationsDeutschFingers Crossed LyricsOn “Fingers Crossed” Lauren sings of an ex-lover, and remembers when the pair were still together. Spencer-Smith recalls the good and bad of the relationship, going from the two planning to travel the world… Read More 
Introduced me to your family
Watched my favorite shows on your TV
Made me breakfast in the mornin'
When you got home from work

Makin' plans to travel 'round the world
Said we'd always put each other first
Old love songs we used to play to
Funny, now I hate you

Now, I
Remember when you'd call me late at night
I gave you my hours and advice just tryna fix you
And all your daddy issues
But now, I don't even miss you anymore
So, I
I want all the tears back that I cried
All the hours spent givin' advice on how to write your songs
All you did was prove me wrong
When you said you loved me
Well, you must've had your fingers crossed

Shoulda paid attention to my friends
Tellin' me how bad it's gonna end
Always givin' their opinions
Now I wish I would have listened

I could say I'm sorry, but I'm not
You don't deserve the one thing that you lost

Now, I
Remember when you'd call me late at night
And I gave you my hours and advice just tryna fix you
And all your daddy issues
But now, I don't even miss you anymore
So, I
I want all the tears back that I cried
All the hours spent givin' advice on how to write your songs
All you did was prove me wrong
When you said you loved me
Well, you must've had your fingers crossed

(Oh-oh, oh-oh) Your fingers crossed
(Oh-oh, oh-oh) Your fingers crossed
(Oh-oh, oh-oh) Oh, when you said you loved me
Well, you must've had your fingers crossed

Oh, I
I want all the tears back that I cried
All the hours spent giving advice on how to write your songs
All you did was prove me wrong
Wish you said you loved me
When you didn't have your fingers crossed","Canadian, pop, female vocalists, indie pop, bedroom pop"
75,76,"""All Too Well (Taylor's Version)""",Taylor Swift,"50 ContributorsTranslationsItalianoAfrikaansFrançaissrpskiTürkçeEspañolPortuguêsPolskiMagyarУкраїнськаČeskyDeutschSlovenščinaAll Too Well (Taylor’s Version) Lyrics
I walked through the door with you, the air was cold
But something 'bout it felt like home somehow
And I left my scarf there at your sister's house
And you've still got it in your drawer, even now

Oh, your sweet disposition and my wide-eyed gaze
We're singing in the car, getting lost upstate
Autumn leaves falling down like pieces into place
And I can picture it after all these days

And I know it's long gone and
That magic's not here no more
And I might be okay, but I'm not fine at all
Oh, oh, oh

'Causе there we arе again on that little town street
You almost ran the red 'cause you were lookin' over at me
Wind in my hair, I was there
I remember it all too well

Photo album on the counter, your cheeks were turning red
You used to be a little kid with glasses in a twin-sized bed
And your mother's telling stories 'bout you on the tee-ball team
You taught me 'bout your past, thinking your future was me

And I know it's long gone and
There was nothing else I could do
And I forget about you long enough
To forget why I needed to
'Cause there we are again in the middle of the night
We're dancing 'round the kitchen in the refrigerator light
Down the stairs, I was there
I remember it all too well, yeah

And maybe we got lost in translation
Maybe I asked for too much
But maybe this thing was a masterpiece
'Til you tore it all up
Running scared, I was there
I remember it all too well
And you call me up again
Just to break me like a promise
So casually cruel in the name of being honest
I'm a crumpled up piece of paper lying here
'Cause I remember it all, all, all
Too well

Time won't fly, it's like I'm paralyzed by it
I'd like to be my old self again, but I'm still trying to find it
After plaid shirt days and nights when you made me your own
Now you mail back my things and I walk home alone
But you keep my old scarf from that very first week
'Cause it reminds you of innocence and it smells like me
You can't get rid of it
'Cause you remember it all too well, yeah

'Cause there we are again when I loved you so
Back before you lost the one real thing you've ever known
It was rare, I was there
I remember it all too well

Wind in my hair, you were there
You remember it all
Down the stairs, you were there
You remember it all
It was rare, I was there
I remember it all too well","country, pop, female vocalists, singer-songwriter, acoustic"
76,77,"""Party""",Bad Bunny and Rauw Alejandro,"8 ContributorsTranslationsEspañolDeutschBad Bunny & Rauw Alejandro - Party (English Translation) Lyrics
Yeah, saying
Ra-Rauw

She's been alone for a while
But she doesn't upload anything on social media
Oh-oh (No, no), she makes me overthink
Today she wants to flow, she's tired of thinking
She rolls it up and starts smoking, ah-ayy (Ayy)
She wants to let loose today
She doesn't want any strings attached, she just wants

Party, party, party, party, party, party, party, party
Party, party, party, party, party, party, pa—
Party, party, party, party, party, party, party, party
Party, party, party, party, party, party, party, party (Yeah-yeah-yeah-yeah, ey)

She looked in the mirror (Woo!)
And noticed she was fine, and noticed she was fine
She wants to grind and get high
I'll smack that ass
Whenever you want, ready for you to gеt horny
And to grind it with you all-all night
They just open up their wallеts
We left without anybody noticing
Baby, how greedy
You want to do it with two and I doubt you can handle it (Ayy)
There are so many seats
And you still want to sit on top of my dick
I've made your pussy sentimental, uh
And your panties are wet
Still pretty high, it hasn't come down
She says she's single but she hasn't broken up
And that she dares to do it with Benito and Rauw, hehe
I like you, I like you
We left Threehouse and left to Ocean Park
Running Can-Am, drinking champagne
I'll buy you a Taycan tomorrow

Ayy, ayy, you move deliciously, like those of E11EVEN
She knows she's fine and she shows off since she can
I'm willing and you're willing, but who dares?
Tell me who dares
Because in the hotel there will be an after—

Party, party, party, party, party (Ayy, ayy, ayy), party, party, party (Let's go to the afterparty)
Party, party, party, party, party (Ayy, ayy, ayy), party, party, par—(Let's go to the afterparty)
Party, party (Ayy, ayy), party, party, party, party, party, party
Party, party, party, party, party (Ayy, ayy, ayy), party, party, party (Ra-Rauw)

Pretty nasty foreplay (Uh-huh)
A real booty, but her boobs are plastic (Eeh-eeh)
She has an abdomen, it looks like she does fasting (Ayy)
And now when she eats it, she swallows, she doesn't chew, ayy
Now she's a full ten, forty hours of flirting (Ah)
Wheeling the Four Truck, she likes what's illicit (Woh)
She left him behind, she flipped off her ex (Ayy)
She asks for El Zorro and El Conejo while twerking (Ya!)
Tell me if you want candy
While running away, we got lost in Santurce (Oh-oh)
In the club, may the lights be turned off (Yeah-yeah)
That booty is for you to use (Yeah-yeah)
Tell me, I'll let you abuse me
You have me in a loop
Before it gets in she spits on it (Mami)
I made her ride it and on the bed, we had a— (Ya!)

Party, party, party, party, party, party, party, party
Party, party, party, party, party, party, pa—
Party, party, party, party, party, party, party, party (Oh-oh-oh)
Party, party, party, party (Yeah), party, party, party, party

Hahahahai
Oof, enjoying the night and many other things, beautiful
They are all saints when they talk about the sins of others
Oof, hahahahaha
Hey, hey, life
Who understands things like that? Who understands it?
Hey, hahahaha",reggaeton; trap latino; urbano latino; latin
77,78,"""Después de la Playa""",Bad Bunny,"29 ContributorsTranslationsEnglishDeutschРусский (Russian)Después de la Playa Lyrics

Yeah-yeah, yeah-yeah, yeah-yeah
Eh-eh
Ja, ja
Eh-eh, eh-eh, eh

Tú dice' que no me atrevo
Si supiera' que yo ando a fuego
Dime qué tú juega' y yo lo juego
No lo dejemo' pa' luego, no
Que la luz ya se fue
Y la noche llegó, ey
Quiero saber si usted quiere lo mismo que yo

Dime pa' dónde vamo' después de la playa
Si nos secamo', yo traigo la toalla
Y de nuevo nos mojamo', pero en mi cama
Te vo'a dar tabla de surfear, yeah
Dime pa' dónde vamo' después de la playa
Si nos secamo', yo traigo la toalla
Y de nuevo nos mojamo', pero en mi cama
Te vo'a dar tabla de surfear, bebé

Dime, ¿vamo' pa'l mambo o no vamo' pa'l mambo?
Tú me dice', mami
Zumba
¿Qué?
Ey, ey, ey
Hoy sí que sí, ah
Wuh
Ey

Dime pa' dónde vamo' después de la playa
Si nos secamo', yo traigo la toalla
Y de nuevo nos mojamo', pero en mi cama
Te vo'a dar tabla de surfear, bebé

Mami, tú vive' lejo' (¿Qué?)
Pero comoquiera yo vo'a buscarte (Wuh)
Porque tú 'tás buena y te lo merece' (Tú 'tás rica)
Al frente 'el mar es que yo quiero darte (Ah, ah, ah)
Pa' que se pongan contento' to' los pece' (Wuh)
Y tú estás mojá', yo estoy ready pa' surfearte (Estoy ready)
Tranquila, que yo sé que esto e' a vece' (Normal)
La otra ve' en la playa te emborrachaste y pediste que te bese (¿Cómo fue?), yeh

¿Cómo?
Ey, ey, ey, ey, ey, ey, ey, ey
Prende eso, prende eso, prende eso
¿Cómo?
Ando con El Apechao
Que no me llame nadie hoy, ¿okey?
Me lo vo'a beber to' (¡Ja!)

Ey, to' el mundo borracho bailando en la playa
Sintiendo el calor, sintiendo el calor
Tú llevas rato mirando y mirando
Pégate mejor, pégate mejor
De esa' chapa' se habla en toa' las barbería'
Y en el colmadón, y en el colmadón (¿Cómo?), ey
Tu novio se cree Romeo y yo le vo'a hacer como Don
Le vo'a hacer como Don, ¿qué, qué, qué?

(¿Qué tú dice'?)
Salí con tu mujer
Ya Dio' me perdonó, falta' tú
¿Qué, qué, qué?
'Toy borracho, borracho
Ey, ey, ey, ey, ey, ey
¿Qué tú dice', Beto?
No le vo'a bajar, ¿okey?
No le baje', no le baje'
Ah, ah, ah, ah, ah, ah, ah (¿Cómo?)
Ey, ey, ey, ey, ey
Qué gozadera
Ey, ey, ey, ey, ey
Que no se apague
Ey, ey, ey, ey
¿Pa'ónde vamo'? ¿Pa'ónde vamo'?
Dime, despué' de aquí

Mera
¿Y este cabrón quién e'? El que está cogiendo cerveza 'e la neverita, tú, allá
¿Anda' con nosotro'?
Ah, okey, okey, okey, okey, dale","Reggaeton, latin, trap, puerto rico, rap"
78,79,"""You Should Probably Leave""",Chris Stapleton,"14 ContributorsYou Should Probably Leave Lyrics
I know it ain't all that late
But you should probably leave
And I recognize that look in your eyes
Yeah, you should probably leave

'Cause I know you and you know me
And we both know where this is gonna lead
You want me to say that I want you to stay
So you should probably leave
Yeah, you should probably leave

There's still time for you to finish your wine
Then you should probably leave
And it's hard to resist, alright, just one kiss
Then you should probably leave

'Cause I know you and you know me
And we both know where this is gonna lead
You want me to say that I want you to stay
So you should probably leave
Yeah, you should probably leave

Like a devil on my shoulder, you keep whisperin' in my ear
And it's gettin' kinda hard for me to do the right thing here
I wanna do the right thing, baby

Sun on your skin, 6AM
And I been watchin' you sleep
And honey, I'm so afraid you're gonna wake up and say
That you should probably leave

'Cause I know you and you know me
And we both know where this is gonna lead
I want you to stay but you'll probably say
That you should probably leave
Yeah, you should probably leave
Oh, you should probably leave","country, americana, singer-songwriter, folk, bluegrass"
79,80,"""Rockin' Around the Christmas Tree""",Brenda Lee,"44 ContributorsRockin’ Around the Christmas Tree Lyrics
Rockin' around the Christmas tree
At the Christmas party hop
Mistletoe hung where you can see
Every couple tries to stop
Rockin' around the Christmas tree
Let the Christmas spirit ring
Later, we'll have some pumpkin pie
And we'll do some caroling

You will get a sentimental feeling
When you hear
Voices singing, ""Let's be jolly
Deck the halls with boughs of holly""

Rockin' around the Christmas tree
Have a happy holiday
Everyone's dancin' merrily
In the new old-fashioned way


You will get a sentimental feeling
When you hear
Voices singing, ""Let's be jolly
Deck the halls with boughs of holly""

Rockin' around the Christmas tree
Have a happy holiday
Everyone's dancin' merrily
In the new old-fashioned way","oldies, 60s, country, female vocalists, rockabilly"
