Unnamed: 0,No.,Title,Artist(s),lyrics,genres
39,40,"""Save Your Tears""",The Weeknd and Ariana Grande,"3 ContributorsThe Weeknd & Ariana Grande - Save Your Tears (Remix) (Traducción al Español) Lyrics""]

Uh (Uh)
Na-na, sí

Te vi bailando en una habitación llena de gente (Ah)
Te ves tan feliz cuando no estoy contigo
Pero luego me viste, te cogí de sorpresa
Una sola lágrima cayendo de tu ojo

No sé por qué me escapo (Oh)
Te hago llorar cuando me escapo (Oh)

Llévame de vuelta porque quiero quedarme
Guarda tus lágrimas para otro

Guarda tus lágrimas para otro día (Oh)
Guarda tus lágrimas para otro día (Mm)

Te conocí una vez bajo la luna de Piscis
Mantuve mi distancia porque sé que
No te gusta cuando estoy con alguien más
No pude evitarlo, te hice pasar por el infierno

No sé por qué me escapo, oh chico (Escapo, oh sí; sí)
Te hago llorar cuando me escapo (Escapo, oh; oh)

Chico, llévame de vuelta porque quiero quedarme
Guarda tus lágrimas para otro
Me doy cuenta de que es demasiado tarde
Y te mereces a alguien mejor

Guarda tus lágrimas para otro día (Oh)
Guarda tus lágrimas para otro día (Oh)

(Bam, bam, bam, bam, bam)
No sé por qué me escapo (Oh)
(Bam, bam, bam, bam, bam)
Te hago llorar cuando me escap (Guarda)

Guarda tus lágrimas para otro día (Uh; oh)
Uh, nena, dije (Está bien)
Guarda (Guarda) tus (Tus) lágrimas para otro día (Oh, yeah, yeah; oh)

Guarda tus lágrimas para otro día (Oh)
Guarda tus lágrimas para otro día (Oh)
Guarda tus lágrimas para otro día",
40,41,"""Smokin out the Window""",Silk Sonic (Bruno Mars and Anderson .Paak),"106 ContributorsTranslationsPortuguêsSmokin Out The Window Lyrics“Smokin Out The Window” is the third single from Silk Sonic’s debut album An Evening with Silk Sonic. The song was first teased on the duo’s Rolling Stone issue, posted in August 2021.
The track’s release… Read More 
Wait a minute, this love started out so tender, so sweet
But now she got me smokin' out the window
Mm, mm, mm

Must've spent thirty-five, forty-five thousand up in Tiffany's (Oh no)
Got her badass kids runnin' 'round my whole crib
Like it's Chuck E. Cheese (Woah, woah)
Put me in a jam with her ex-man in the UFC
Can't believe it (Can't believe it)
I'm in disbelief

This bitch got me payin' her rent, payin' for trips
Diamonds on her neck, diamonds on her wrists
And here I am all alone (All alone)
I'm so cold, I'm so cold
You got me out here

Smokin' out the window (Smokin' out the window)
Singin', ""How could she do this to me?""
(How could she do this to me?)
Oh, I thought that girl belonged to only me (Mmm)
But I was wrong
'Cause she belong
To everybody, everybody, ooh

Just the other night, she was grippin' on me tight
Screamin', ""Hercules"" (Hercules, Hercules)
Got me in the club lookin' for a new love
Someone help me, please (Help me, please, help me, please)
Baby, why you doin' this? Why you doin' this to me, girl?
Not to be dramatic, but I wanna die

This bitch got me payin' her rent, payin' for trips
Diamonds on her neck, diamonds on her wrists
And here I am all alone (All alone)
I'm so cold, I'm so cold
You got me out here

Smokin' out the window (Smokin' out the window of the Benzo, the Benzo)
Singin', ""How could she do this to me?"" (How? How could she do this?)
Oh, I thought that girl belonged to only me (One thing's for sure, one thing's for sure)
But I was wrong (I was wrong)
'Cause she belong (She belong)
To everybody, everybody (Yeah, she belong to everybody)
(That girl, yes, she belong to everybody) Ooh

(Oh no)
Look here, baby, I hope you find whatever it is that you need
But I also hope that your triflin' ass is walkin' 'round barefoot in these streets
Look out

Girl, it breaks my heart that you ain't right here with me
Now I gotta give you back (Gotta give you back)
To the city, oh, you got me

Smokin' out the window (Ooh)
Singin', ""How could she do this to me?"" (How could you?)
(How could you do this, baby?)
Oh, I thought that girl belonged to only me (Woo-hoo, ooh-hoo-hoo)
But I was wrong (I was wrong)
'Cause she belong (She belong)
To everybody, everybody (Yeah, she belong to everybody)
(Yeah, yeah, she belong to everybody) Ooh",
41,42,"""Levitating""",Dua Lipa,"169 ContributorsTranslationsTürkçeEspañolفارسیDeutschFrançaisNederlandsPolskiČeskyItalianoLevitating LyricsWith themes of space travel and excitement, “Levitating” is a joyful ode to the often-quick process of falling in love. Originally included on Dua Lipa’s 2020 album, Future Nostalgia, the song found new wind… Read More 
If you wanna run away with me, I know a galaxy
And I can take you for a ride
I had a premonition that we fell into a rhythm
Where the music don't stop for life
Glitter in the sky, glitter in my eyes
Shining just the way I like
If you're feeling like you need a little bit of company
You met me at the perfect time

You want me, I want you, baby
My sugarboo, I'm levitating
The Milky Way, we're renegading
Yeah, yeah, yeah, yeah, yeah

I got you, moonlight, you're my starlight
I need you all night, come on, dance with me
I'm levitating
You, moonlight, you're my starlight (You're the moonlight)
I need you all night, come on, dance with me
I'm levitating

I believe that you're for me, I feel it in our energy
I see us written in the stars
We can go wherever, so let's do it now or never
Baby, nothing's ever, ever too far
Glitter in the sky, glitter in our eyes
Shining just the way we are
I feel like we're forever every time we get together
But whatever, let's get lost on Mars

You want me, I want you, baby
My sugarboo, I'm levitating
The Milky Way, we're renegading
Yeah, yeah, yeah, yeah, yeah

I got you, moonlight, you're my starlight
I need you all night, come on, dance with me
I'm levitating
You, moonlight, you're my starlight (You're the moonlight)
I need you all night, come on, dance with me
I'm levitating

You can fly away with me tonight
You can fly away with me tonight
Baby, let me take you for a ride
Yeah, yeah, yeah, yeah, yeah
I'm levitating (Woo)
You can fly away with me tonight
You can fly away with me tonight
Baby, let me take you for a ride
Yeah, yeah, yeah, yeah, yeah (Woo)

My love is like a rocket, watch it blast off
And I'm feeling so electric, dance my ass off
And even if I wanted to, I can't stop
Yeah, yeah, yeah, yeah, yeah
My love is like a rocket, watch it blast off
And I'm feeling so electric, dance my ass off
And even if I wanted to, I can't stop
Yeah, yeah, yeah, yeah, yeah

You want me, I want you, baby
My sugarboo, I'm levitating
The Milky Way, we're renegading

I got you (Yeah), moonlight, you're my starlight
I need you all night (All night), come on, dance with me
I'm levitating (Woo)

You can fly away with me tonight (Tonight)
You can fly away with me tonight
Baby, let me take you for a ride
Yeah, yeah, yeah, yeah, yeah (Take you for a ride)
I'm levitating (Woo)
You can fly away with me tonight (Tonight)
You can fly away with me tonight
Baby, let me take you for a ride
Yeah, yeah, yeah, yeah, yeah (Let me take you for a ride)

I got you, moonlight, you're my starlight (You are my starlight)
I need you all night, come on, dance with me (Come on, dance with me)
I'm levitating
You, moonlight, you're my starlight (You're the moonlight)
I need you all night, come on, dance with me
I'm levitating","pop, synthpop, electropop, british, female vocalists"
42,43,"""In a Minute""",Lil Baby,"72 ContributorsTranslationsEspañolPortuguêsIn A Minute LyricsIn “In A Minute,” Atlanta native Lil Baby raps about his extravagant lifestyle after coming from a treacherous background. Throughout the track, Baby also switches between topics from his wealth to firearms… Read More 
(Damn, Kai, you goin' crazy)

I be in the loop, she be in a group (Yeah)
Brodie want her friend, throw 'em alley-oop (Yeah)
Turned somethin' to nothin', bruh, I'm livin' proof
How can I lose when we the who's who's?
Still runnin' 'round with Mohawk, jet ready, pack the Goyard
People probably think I show off, I ain't even give it yet
Runnin' up a silly check, stayin' off the internet
Share the stage with Billie Eilish, turnt at any given time
Personal partners pillow talkin' 'cause I got rich without 'em
Only thing they should be sayin' is, ""Baby keep it solid""
We ain't even deep as we used to be, this shit slick, divided
Bruh ain't got no hustle or nothin', so he gon' stick to violence
I be known to run down, I'm dialed in, so I can't speak about it
She know I'm a gangster, she love me, I bring the freak up out her
Can't play with me, you know I come trim, I'm in a different league
I'm tired of showin' what I can get done, what you gon' do for me?
Forty-thousand miles up in the air, only time I get some Z's
Full-court press, foot on they neck, and I can't let 'em breathe
Blood, sweat, and tears come with this check, it ain't nowhere near easy
Had to fall back, you know how that go, we only speakin' briefly
Hope I'm not too much to handle, city nigga from Atlanta
I spent my last check on ammo, this is not a regular Lambo
Hundred thousand dollars kit, could've put down on another Lambo
Don't be in the mix, I built this shit forever havin' say so
This shit gon' get serious about my money, this ain't no fuckin' Play-Doh
Brodie down for double homicide, I try to tell him, ""Lay low""
C don't like to drive, but he spin good, I'm on the way to Clayco
AK-47s in the spots before they made the Draco

I'm just tryna ball and live, hundred mill', I'm calling dibs
I'm the boss, pay all the bills, I'm the golden child for real
Go off in this bitch, I will, I been on my grind for years
And I'm out here grinding still, I need equity to sign the deal
I'm just tryna ball and live, hundred mill', I'm calling dibs
I'm the boss, pay all the bills, I'm the golden child for real
Go off in this bitch, I will, I been on my grind for years
And I'm out here grinding still, I need equity to sign the deal

Overbuying cars, I snatch the Brabus just for motivation
Shootout at the spot today, tomorrow, we in a new location
Free all of the guys, I hope y'all beat the case or get probation
Stash it at my mama house, four hundred bands in the ventilation
Now look how I'm living, I bought a house for the money to stay at
Right when niggas think that I got soft, I'ma pull up and spray at
Living like a don, might smoke a blunt in the back of the Maybach
Pull up like your mama with the switch, ""Why the fuck would you say that?”
You can do it first, I'ma do it worst, gotta double the pay back Never take it personal, show no mercy, bruh taught me that way back
Condo to get off, I was always taught, ""Don't tell hoes where you stay at""
Keep a stash house, you can't take nothing to the spot where you lay at
Never be a bother, if you off me, no problem, just say that
Never runnin' off, so if I owe you, I got you, I'll pay that
Give this shit my all, so when I'm old, I can chill and just lay back
Really from the bottom so the trenches is where I feel safe at

I'm just tryna ball and live, hundred mill', I'm calling dibs
I'm the boss, pay all the bills, I'm the golden child for real
Go off in this bitch, I will, I been on my grind for years
And I'm out here grinding still, I need equity to sign the deal
I'm just tryna ball and live, hundred mill', I'm calling dibs
I'm the boss, pay all the bills, I'm the golden child for real
Go off in this bitch, I will, I been on my grind for years
And I'm out here grinding still, I need equity to sign the deal","rap, Hip-Hop, hip hop, trap, atlanta"
43,44,"""Moscow Mule""",Bad Bunny,"33 ContributorsTranslationsEnglishDeutschFrançaisItalianoРусский (Russian)Moscow Mule Lyrics“Moscow Mule” es el nombre que recibe el tema que abre el álbum UN VERANO SIN TI, y que además sirve como primer sencillo del proyecto discográfico, al ser lanzado junto a su video oficial.
La canción toma… Read More 

Si yo no te escribo, tú no me escribe', ey
Si tú quieres, te busco, yo sé dónde tú vive'
Quizá hoy está aborrecía'
Pero por dentro tú tiene' alegría

Si quieres te la saco
Dos trago' y sabes que me pongo bellaco
No somo' na', pero estamo' envuelto' hace rato, oh-oh
WhatsApp sin el retrato, no guarda mi contacto (¡Ey, ey, ey, ey!)
Pero se la saco
Dos trago' y sabes que me pongo bellaco
No somo' na', pero estamo' envuelto' hace rato, oh-oh
WhatsApp sin el retrato, no guarda mi contacto-to

Todo e' underwater (Ey)
Baby, vamo' pa'l cuarto quarter
En la Uru' comiéndono' el pare
Te vo'a dar duro pa' que no me compare', ey
Cuida'o con ese mahón, que se va a romper (Ey)
Ese booty lo va a romper (Ey)
Yo no sé si yo te vuelvo a ver
Si mañana me vo'a perder
Tú ere' una player, me hiciste un crossover
Esta ve' metiste, me diste game over, eh-eh (Huh)
Porque no puedo olvidar
El perreo aquel que se fue viral
Dime si mañana te va' a quedar
Después de la alarma te lo voy a dar, ey
Hoy tú no va' a trabajar, je, no

Si quieres te la saco
Dos trago' y sabes que me pongo bellaco
No somo' na', pero estamo' envuelto' hace rato, oh-oh, oh
WhatsApp sin el retrato, no guarda mi contacto
Pero se la saco
Dos trago' y sabes que me pongo bellaco
No somo' na', pero estamo' envuelto' hace rato, oh-oh
WhatsApp sin el retrato, no guarda mi contacto

Me gustan así, piquetúa
Mami, qué rica te ve' esnúa'
Quizás no sentiste lo que yo sentí
Pero aún te debo una noche en la suite
Pa' darte tabla; dale, mami, habla
Tú ere' una diablona, no te haga'
Pa' darte tabla; dale, mami, habla
Tú ere' una diablona, no te haga'

No, no, no, no (No, no, no, no)
No, no, no, no (No, no, no, no)
No, no, no, no (No, no, no, no)
Ey, yo no sé tú, pero yo quisiera amanecer esnú'
En una playa por Bali, si no, Cancún
Pide otro moscow mule (Ey)

Que ando en nota, nota
Ven y choca
Conmigo que se joda
Baby, tú 'tás grandota
Pero hoy ando en nota, nota
Ven y choca
Conmigo que se joda, eh
Que se joda, ey

Mami, tú quiere' perreo (Tú quiere' perreo)
Tú quiere' perreo (Tú quiere' perreo)
Tú quiere' bellaqueo (Tú quiere' bellaqueo)
Tú quiere' bellaqueo (Tú quiere' bellaqueo)
Mami, tú quiere' perreo (Tú quiere' perreo)
Tú quiere' perreo (Tú quiere' perreo)
Tú quiere' bellaqueo (Tú quiere' bellaqueo)
Tú quiere' bellaqueo (Tú quiere' bellaqueo)","Reggaeton, latin, trap, puerto rico, rap"
44,45,"""You Right""",Doja Cat and the Weeknd,"10 ContributorsTranslationsEnglishEspañolPortuguêsDeutschFrançaisPolskiDoja Cat & The Weeknd - You Right (Türkçe Çeviri) Lyrics

Bir adamım var ama seni istiyorum
Bir adamım var ama seni istiyorum
Ve sadece cüret, sadece alet
Beni başka biri hakkında düşündürtüyor
Biliyorsun söyleyeceğim çok şey var
Yüzümde saklamaya çalışıyorum
Ama işe yaramıyor, yüzümden okuyabiliyorsun
Sadece senle olmak istediğimi
Ve sen haklısın

Sen haklısın, erkeğimi aldım
Ama engel olamıyorum, seni istiyorum
Dedim ki haklısın, erkeğimi aldım
Ama ben, engel olamıyorum, seni istiyorum

Durup başka yere bakamıyorum
Çünkü biliyorum olabilir, bebeğim, ve sеn aynısını hissetmeyebilirsin
Onun hakkında hеr gün hakkında düşünüyorsun
Peri masallarına inanmıyorsun, ama bizim de fantezilerimiz var
Ve sadece ben ve sen, o yok
Çarşaflarına serilmek istiyorum
Üstümün her yerindesin
O kadar da derin değilmiş gibi davranıyorsun
Oğlum, sinirini benden çıkarabilirsin
Ne olmak üzere, söyle bana
Olmak zorundaymış gibi hissediyorum
Kimseye söyleyemem ama herkes biliyor

Bir adamım var ama seni istiyorum
Bir adamım var ama seni istiyorum
Ve sadece cüret, sadece alet
Beni başka biri hakkında düşündürtüyor
Biliyorsun söyleyeceğim çok şey var
Yüzümde saklamaya çalışıyorum
Ama işe yaramıyor, yüzümden okuyabiliyorsun
Sadece senle olmak istediğimi
Ve sen haklısın

Sen haklısın, erkeğimi aldım
Ama engel olamıyorum, seni istiyorum
Dedim ki haklısın, erkeğimi aldım
Ama ben, engel olamıyorum, seni istiyorum

Kızım, ben de seni beni istediğin gibi istiyorum
O enerjiyi hissediyorum (Oh, evet) sen benim üstümdeyken (Oh, evet)
Senin adamını biliyorum, seni kontrol etmiyor
Ama hala tereddüt ediyorsun (Oh) çünkü sadakati seçtin (Oh, evet)
Ama senin hikayeni biliyorum (Hey), senin zirvenden önce onla tanıştım (Hey)
Senin eskiden olduğun kadına çok bağlı
Ama-Ama-Ama seks hafızanı bulandırmış
Birkaç okşayış, onu içine koyacağım, sonra bana ait olacaksın

Bir adamım var ama seni istiyorum
Bir adamım var ama seni istiyorum
Ve sadece cüret, sadece alet
Beni başka biri hakkında düşündürtüyor
Biliyorsun söyleyeceğim çok şey var
Yüzümde saklamaya çalışıyorum
Ama işe yaramıyor, yüzümden okuyabiliyorsun
Sadece senle olmak istediğimi (Evet, evet, evet, evet)

Ve sen haklısın (Evet)
Sen haklısın, erkeğimi aldım (erkeğimi)
Ama engel olamıyorum, seni istiyorum
Dedim ki haklısın (evet), erkeğimi aldım (evet)
Ama ben (evet), engel olamıyorum, seni istiyorum",
45,46,"""She Had Me at Heads Carolina""",Cole Swindell,"10 ContributorsShe Had Me At Heads Carolina Lyrics
(Heads Carolina, tails California)

I was out with the boys, catchin' up in a neon light
Didn't know 'til we walked in it was karaoke night
She was in a circle of girls, chasin' a shot with a lime
She was laughin', they were darin' her to get on the mic
One of 'em walked up and turned in her name
Next thing I knew, man, she was up on the stage, singin'

""Heads Carolina, tails California""
Maybe she'd fall for a boy from South Georgia
She's got the bar in the palm of her hand
And she's a '90s country fan like I am
Hey, I got a Chevy, she can flip a quarter
I'd drive hеr anywhere from herе to California
When this song is over, I gotta find her
'Cause she had me at ""Heads Carolina""

Yeah, she knew every word by heart, didn't need no screen, no
I was raisin' my glass up for her, I saw her smilin' at me, yeah
She had me down in the front by the end of verse two
Like there wasn't no one else in the room, we were singin'

""Heads Carolina, tails California""
Maybe she'd fall for a boy from South Georgia
She's got the bar in the palm of her hand
And she's a '90s country fan like I am
Hey, I got a Chevy, she can flip a quarter
I'd drive her anywhere from here to California
When this song is over, I gotta find her
'Cause she had me at ""Heads Carolina""

Yeah, I bought her a round and we talked 'til the lights came on
I still see that girl every time I hear that song

""Heads Carolina, tails California""
Maybe she'd fall for a boy from South Georgia
She's got the bar in the palm of her hand
And she's a '90s country fan like I am
Hey, I got a Chevy, she can flip a quarter
I'd drive her anywhere from here to California
When this song is over, I gotta find her
'Cause she had me at ""Heads Carolina""

(Heads Carolina, tails California)
Yeah, she had me at ""Heads Carolina"" (Somewhere greener, somewhere warmer)
(Heads Carolina, tails California)
Yeah (Somewhere greener, somewhere warmer)
(Heads Carolina)
(Somewhere together, I've got a quarter)
(Heads Carolina, tails California)","country, contemporary country, United States, male vocalists, bro-country"
46,47,"""Vegas""",Doja Cat,"85 ContributorsTranslationsTürkçeРусский (Russian)Vegas Lyrics
Yeah, ah, get it
Yeah, ah, get it
Yeah, yeah, ah, get it
Yeah, ah, get it
Yeah, ah, get it
Yeah

You ain't nothin' but a
Dog player, I get it
Fraud player, I get it
I understand, I understand
You ain't the man, you ain't a man
You ain't nothin' but a
Hound dog, hound dog, hound dog
You ain't nothin' but a

Player gettin' valeted around in that ho whip
Two fingers up, one down when my toes ten
Flewed out with my boobs out, put a cork in it
Love it when you be cryin' out when I'm corseted
I don't think he gon' make it, do not let me start ragin'
****, I'm losin' my patience, this ain't stayin' in Vegas (You ain't nothin' but a)
There's more sides to the story, I'ma tell everybody
Had your ass sittin' courtside with your arm around me
Had your ass sittin' first class with your burnt ass out in Abu Dhabi
Coulda been what we shoulda been
But you lost a bet, now you gotta find me
Find a seat
I ain't playin', that's hide and seek
High school when you finally peaked
Hound dog, couldn't find a treat
I'm a bad bitch, but

You ain't nothin' but a
Dog player, I get it
Fraud player, I get it
I understand, I understand
You ain't the man, you ain't a man
You ain't nothin' but a
Hound dog, hound dog, hound dog (Yeah, yeah, said)
You ain't nothin' but a

I get it, I know you got some other **** you on
And I get it, you needed someone that could prove you wrong
So I reckon you leave all of your problems at the door to my city
You gon' need to tell my brothers where you from
And I admit it, I still got empathy
And you gon' feel it for two weeks when I release you in them sheets (You ain't nothin' but a)
And keep my nina indiscreet, keep the cleaner in my Jeep
Then put that Yeezy in your teeth, let my demons off they leashes
If you even think to speak, I'ma give a whole new meanin'
When you said you livin' a dream, we can keep that **** asleep
And you gon' laugh with all your Gs
Countin' them sheep, sheep, sheep, sheep
Talkin' 'bout Z-Z-Z-Z-Z-Z-Z, R.I.P

You ain't nothin' but a
Dog player, I get it
Fraud player, I get it
I understand, I understand
You ain't the man, you ain't a man
You ain't nothin' but a
Hound dog, hound dog, hound dog
You ain't nothin' but a
Dog player, I get it
Fraud player, I get it
I understand, I understand
You ain't the man, you ain't a man
You ain't nothin' but a
Hound dog, hound dog, hound dog
You ain't nothin' but a

Yeah, ah, get it
Yeah, ah, get it
Yeah, yeah, ah, get it
Yeah, ah, get it
Yeah, yeah, ah, get it
Yeah, you ain't nothin' but a","pop, rnb, rap, Hip-Hop, hip hop"
47,48,"""Pushin P""",Gunna and Future featuring Young Thug,"4 ContributorsTranslationsEnglishEspañolPortuguêsDeutschGunna & Future - pushin P ft. Young Thug (Русский перевод) Lyrics
(Wheezy outta here)
Живу, как P
Е, живу, как P, прибавь мне звук
Прибавь мне звук, ага

Патек и подвеска со стрелочками, я живу, как P
Поставил медную рукоять на пистолет, мы не хотим мир
Есть хата прямо напротив хаты чисто для P
Поделился точкой, дальше строим планы, экзотичные P
Она не лесбиянка, но ради P станет Плутосбиянкой (Живу, как P, я живу, как P)
Благодаря большой P, у меня полно дохлых президентов, подсчитаю президентов
Португалка на коленях, моя бандана — P
Она дала потискать, потом ушла, потому она оставила P
Приватный номер, приватные места, сука, я живу, как P
Пинта пойла, писька порозовела, сука, я живу, как P

Живу, как P, я живу, как P, живу, как P, я живу, как P, е (Знаю чё говорю)
Живу, как P, я живу, как P, живу, как P, я живу, как P, е
Принял Пёрк, я параною, не могу поспать
У меня глубокие карманы, я при деньгах
Зачем они за мной следят?
Я живу, как P, я живу, как P, живу, как P, я живу, как P, е

Короче, я тут, а, а, купил Ламбу
Оппы на улице, а, а, а
Окей, купил ей P, не Пёрк, а Порше (Живу, как P)
Три Перка, пью, подливаю, Порше (Скр, я живу, как P)
Я только что выебал стакан воды (Да, я сделал это)
Живу, как P, красная бандана, Кардиналы (Эй, живу, как P)
Я поотнимаю все твои контракты
Она не винирится для меня, а просто фарфорится (Никогда)
Я никогда не видел оппов, мы наконец-то помахались (Никогда)
Она готова выйти ради меня на улицы, без вопросов (Конечно, скр)
Слишком богат, чтоб писать СМС, пусть моя малая перешлёт (Е)
Вынул все P, из алфавитов, нигга, попробуй их разобрать (Эй)

Я живу, как P, я живу, как P, яживу, как P
Живу, как P, я живу, как P, P, а-а
Живу, как P, я живу, как P, я живу, как P
Я живу, как P, е, а-а",melodic rap
