Unnamed: 0,No.,Title,Artist(s),lyrics,genres
19,20,"""Better""",Khalid,"196 ContributorsTranslationsفارسیDeutschBetter Lyrics“Better” serves as the follow up to Khalid’s previous single “OTW” which featured verses from both 6LACK and Ty Dolla $ign. Although his previous single was all about being there for a significant other… Read More 
Better
Nothing, baby
Nothing feels better
I'm not really drunk, I never get that fucked up
I'm not, I'm so sober

Love to see you shine in the night like the diamond you are
(Love to see you shine in the night like the diamond you are)
I'm good on the side, it's alright, just hold me in the dark
(I'm good on the side, it's alright, just hold me in the dark)
No one's gotta know what we do, hit me up when you're bored
(No one's gotta know what we do, hit me up when you're bored)
'Cause I live down the street
So we meet when you need and it's yours
All I hear is...

Nothing feels better than this
Nothing feels better
Nothing feels better than this
Nothing feels better, oh no
We don't gotta hide, this is what you like
I'll admit
Nothing feels better than this

You say we're just friends but I swear when nobody's around
(You say we're just friends but I swear when nobody's around)
You keep my hand around your neck, we connect, are you feeling it now?
(You keep my hand around your neck, we connect, are you feeling it now?)
'Cause I am
I got so high the other night, I swear to God, felt my feet lift the ground
(I got so high the other night, I swear to God I felt my feet lift the ground)
Ooh, yeah
Your back against the wall, this is all you've been talking about
In my ears

Nothing feels better than this
Nothing feels better
Nothing feels better than this
Nothing feels better, oh no
We don't gotta hide, this is what you like
I admit
Nothing feels better than this

Now, left, right, left, right
Take it back, bring it side to side
Like that, like that, ayy
Ooh, now, left, right, left, right
Take it back, bring it side to side
Like

Nothing feels better than this
Nothing feels better
Nothing feels better than this
Nothing feels better, oh no
We don't gotta hide, this is what you like
I admit
Nothing feels better than this (Better than this)

Nothing feels better than this","soul, rnb, pop, alternative rnb, alternative"
20,21,"""No Guidance""",Chris Brown featuring Drake,"2 ContributorsNo Guidance - Chris Brown ft. Drake (Devvon Terrell Cover) Lyrics
My name is Devvon Terrell
This is a raw session
You know the vibes

Trips that you plan for the next whole week
Bands too long for a nigga so cheap
And your flex OD, and your sex OD
You got it, girl, you got it (Oh)
Oh lemme tell you
You got it, girl, you got it
You should deal with a five star nigga
Know you work more than just 6 figures
I'm applying the pressure my finger on the trigger
I know you got a roster just full of hittas
But you need a first line up like Kawhi to the Clippers
Been through so much shit that you don't even know the difference
Made so many mental notes that you can't save a picture
Got so many cuts and bruises I was still invested
Still treat you like the best like KD to the Nets

I see you and I know you legit (Yeah)
High off you, I need a fix (Yeah)
You a hot girl I'm off this lukewarm
That's like comparing you to a groupon chile

You got it, girl, you got it (Aye)
You got it, girl, you got it",
21,22,"""Girls Like You""",Maroon 5 featuring Cardi B,"3 ContributorsGirls Like You - Maroon 5 ft. Cardi B  LyricsSpent 24 hours
I need more hours with you
You spent the weekend
Getting even, ooh ooh
We spent the late nights
Making things right, between us
But now it's all good baby
Roll that Backwood baby
And play me close
'Cause girls like you
Run around with guys like me
'Til sundown, when I come through
I need a girl like you, yeah yeah
Girls like you
Love fun, yeah me too
What I want when I come through
I need a girl like you, yeah yeah
Yeah yeah yeah
Yeah yeah yeah
I need a girl like you, yeah yeah
Yeah yeah yeah
Yeah yeah yeah
I need a girl like you, yeah yeah
I spent last night
On the last flight to you
Took a whole day up
Trying to get way up, ooh ooh
We spent the daylight
Trying to make things right between us
And now it's all good baby
Roll that Backwood baby
And play me close
'Cause girls like you
Run around with guys like me
'Til sundown, when I come through
I need a girl like you, yeah yeah
Girls like you
Love fun, yeah me too
What I want when I come through
I need a girl like you, yeah yeah
Yeah yeah yeah
Yeah yeah yeah
I need a girl like you, yeah yeah
Yeah yeah yeah
Yeah yeah yeah
I need a girl like you, yeah yeah
I need a girl like you, yeah yeah
I need a girl like you
Maybe it's 6:45
Maybe I'm barely alive
Maybe you've taken my shit for the last time, yeah
Maybe I know that I'm drunk
Maybe I know you're the one
Maybe I'm thinking it's better if you drive
'Cause girls like you
Run around with guys like me
'Til sundown, when I come through
I need a girl like you, yeah yeah
'Cause girls like you
Run around with guys like me
'Til sundown, when I come through
I need a girl like you, yeah yeah
Girls like you
Love fun, yeah me too
What I want when I come through
I need a girl like you, yeah yeah
Yeah yeah yeah
Yeah yeah yeah
I need a girl like you, yeah yeah
Yeah yeah yeah
Yeah yeah yeah
I need a girl like you",
22,23,"""Sweet but Psycho""",Ava Max,"162 ContributorsTranslationsPolskiEspañolČeskyItalianoPortuguêsDeutschSweet but Psycho LyricsAva Max said in an interview with JAMS 96.3,
The track is about a girl who is misunderstood in a relationship. She thinks she’s going out of her mind and psycho. But in reality, she’s just a strong… Read More 
Oh, she's sweet but a psycho
A little bit psycho
At night, she's screamin', ""I'm-ma-ma-ma out my mind""
Oh, she's hot but a psycho
So left, but she's right though
At night, she's screamin', ""I'm-ma-ma-ma out my mind""

She'll make you curse, but she a blessin'
She'll rip your shirt within a second
You'll be comin' back, back for seconds
With your plate, you just can't help it

No, no
You'll play alo-o-ong, let her lead you o-o-on
You'll be sayin', ""No, no""
Then sayin', ""Yes, yes, yes,"" 'cause she messin' with your head

Oh, she's sweet but a psycho
A little bit psycho
At night, she's screamin', ""I'm-ma-ma-ma out my mind""
Oh, she's hot but a psycho
So left, but she's right though
At night, she's screamin', ""I'm-ma-ma-ma out my mind""
Grab-a-cop-gun kinda crazy
She's poison but tasty
Yeah, people say, ""Run, don't walk away""
'Cause she's sweet but a psycho
A little bit psycho
At night, she's screamin', ""I'm-ma-ma-ma out my mind""

See, someone said don't drink her potions
She'll kiss your neck with no emotion
When she's mean, you know you love it
She tastes so sweet, don't sugarcoat it

No, no
You'll play alo-o-ong, let her lead you o-o-on
You'll be sayin', ""No (No, no, no), no (No)""
Then sayin', ""Yes, yes, yes,"" 'cause she messin' with your head

Oh, she's sweet but a psycho
A little bit psycho
At night, she's screamin', ""I'm-ma-ma-ma out my mind""
Oh, she's hot but a psycho
So left, but she's right though
At night, she's screamin', ""I'm-ma-ma-ma out my mind""
Grab-a-cop-gun kinda crazy
She's poison but tasty
Yeah, people say, ""Run, don't walk away""
'Cause she's sweet but a psycho
A little bit psycho
At night, she's screamin', ""I'm-ma-ma-ma out my mind""

You're just like me, you're out your mind
I know it's strange, we're both the crazy kind
You're tellin' me that I'm insane
Boy, don't pretend that you don't love the pain

Oh, she's sweet but a psycho
A little bit psycho
At night, she's screamin', ""I'm-ma-ma-ma out my mind""
Oh, she's hot but a psycho
So left, but she's right though
At night, she's screamin', ""I'm-ma-ma-ma out my mind""
Grab-a-cop-gun kinda crazy
She's poison but tasty
Yeah, people say, ""Run, don't walk away""
'Cause she's sweet but a psycho
Oh, a little bit psycho
At night, she's screamin', ""I'm-ma-ma-ma out my mind""","pop, electropop, female vocalists, american, dance pop"
23,24,"""Suge""",DaBaby,"145 ContributorsSuge LyricsIn the second track from his Baby on Baby album, Charlotte rapper DaBaby delivers a homage to Marion “Suge” Knight, the founder, and former head of Death Row Records.
Knight became the CEO of Death Row in… Read More 
Pooh, you a fool for this one
Ha
Oh Lord, Jetson made another one

Hah
Pack in the mail, it's gone (Uh)
She like how I smell, cologne (Yeah)
I just signed a deal, I'm on
Yeah, yeah
I go where I want, I'm good (Good)
Play if you want, let's do it (Ha)
I'm a young CEO, Suge (Yeah)
Yeah, yeah

The first nigga play, I'ma body a nigga (Ha)
I just checked my balance
I'll probably pull up to your hood
And come buy me a nigga (No cap)
You know that your ho told you that nigga crazy
Don't think that she lied to you, nigga (Bitch)
Get caught with your ho when I'm poppin' 'em both
Now they high just like Bobby and Whitney (Haa)
Say I'm the G.O.A.T., act like I don't know
But fuck it, I'm obviously winnin'
Don't make me go hit the bank and take out a hundred
To show you our pockets are different (Ha)
I'm out with your bitch and I only want knowledge
She got a lil' mileage, I'm chillin' (Uh)
You disrespect me and I'll beat your ass up
All in front of your partners and children (Ahh, ahh)
I'm the type to let a nigga think that I'm broke
Until I pop out with a million (I pop)
Take 20K and put that on your head
And make one of your partners come kill you (Yeah)
Say he fuckin' with me then he gotta grow up
'Cause this nigga gotta be kiddin' (Kiddin')
This shit, it can't fit in my pocket
I got it, like I hit the lottery, nigga (Hot, hot, hot)
Opp, I'll slap the shit out a nigga
No talkin', I don't like to argue with niggas (I don't)
Ain't gon' be no more laughin'
You see me whip out 'cause I'm gon' be done shot me a nigga (No cap)
I don't follow no bitches on IG
But all of your bitches, they follow a nigga (Ha)
And that lil' nigga ain't gon' shoot shit with that gun
He just pull it out in his pictures (Bitch, uh)

Hah
Pack in the mail, it's gone (Uh)
She like how I smell, cologne (Yeah)
I just signed a deal, I'm on
Yeah, yeah
I go where I want, I'm good (Good)
Play if you want, let's do it (Ha)
I'm a young CEO, Suge (Yeah)
Yeah, yeah
Hah
Pack in the mail, it's gone (Uh)
She like how I smell, cologne (Yeah)
I just signed a deal, I'm on
Yeah, yeah
I go where I want
I'm good (Good)
Play if you want, let's do it (Ha)
I'm a young CEO, Suge (Yeah)
Yeah, yeah

Talkin' my shit, I'ma pop that (Pop)
Got like thirty-two thousand in one of my pockets
The other one, that's where the Glock at (Glock)
You little niggas wanna be internet gangster
Man, tell all these little niggas stop that (Ha)
Been done burnt me a nigga in front of the store
Where your mammy and grandmama shop at (Bitch)
Hopped out on a whole other wave from these niggas
Let's see one of you little niggas top that
I will turn a nigga into a convertible
Push me a lil' nigga top back (Vroom)
Her boyfriend be hatin' and callin' her groupie
Just 'cause she like all my music (Ha)
She'll send me a text and then delete the message
He tryna find out, it's confusin'
I don't know what these niggas is thinkin' about
Use the brain in your head 'fore you lose it (Bitch)
I'll pull up after school and I'll teach her some shit
Tell your bro I'm a motherfuckin' tutor
'Member I used to cheat off a pretty bitch test
All the teachers, they thought I was stupid (Uh huh)
Was expectin' the box to pull up on a truck
Man, this nigga pulled up on a scooter (The fuck?)

Hah
Pack in the mail, it's gone (Uh)
She like how I smell, cologne (Yeah)
I just signed a deal, I'm on
Yeah, yeah
I go where I want, I'm good (Good)
Play if you want, let's do it (Ha)
I'm a young CEO, Suge (Yeah)
Yeah, yeah
Hah
Pack in the mail, it's gone (Uh)
She like how I smell, cologne (Yeah)
I just signed a deal, I'm on
Yeah, yeah
I go where I want
I'm good (Good)
Play if you want, let's do it (Ha)
I'm a young CEO, Suge (Yeah)
Yeah, yeah","rap, Hip-Hop, trap, hip hop, american"
24,25,"""Middle Child""",J. Cole,"356 ContributorsTranslationsTürkçeEspañolРусский (Russian)PortuguêsFrançaisItalianoMIDDLE CHILD LyricsJ. Cole’s first offering of 2019 serves as a warning in advance of an extensive rollout of Dreamville material. On the track, Cole envisions himself in the center of the old and new generations of hip-hop… Read More 
You good, T-Minus?

Niggas been countin' me out
I’m countin' my bullets, I'm loadin’ my clips
I'm writin' down names, I'm makin' a list
I'm checkin' it twice and I'm gettin’ ’em hit
The real ones been dyin', the fake ones is lit
The game is off balance, I’m back on my shit
The Bentley is dirty, my sneakers is dirty
But that's how I like it, you all on my dick

I'm all in my bag, this hard as it get
I do not snort powder, I might take a sip
I might hit the blunt, but I'm liable to trip
I ain’t poppin' no pill, but you do as you wish
I roll with some fiends, I love 'em to death
I got a few mil' but not all of them rich
What good is the bread if my niggas is broke?
What good is first class if my niggas can't sit?
That's my next mission, that's why I can't quit
Just like LeBron, get my niggas more chips
Just put the Rollie right back on my wrist
This watch came from Drizzy, he gave me a gift
Back when the rap game was prayin' I'd diss
They act like two legends cannot coexist
But I'd never beef with a nigga for nothin'
If I smoke a rapper, it's gon' be legit
It won't be for clout, it won't be for fame
It won't be 'cause my shit ain't sellin' the same
It won't be to sell you my latest lil' sneakers
It won't be 'cause some nigga slid in my lane
Everything grows, it's destined to change
I love you lil' niggas, I'm glad that you came
I hope that you scrape every dollar you can
I hope you know money won't erase the pain
To the OGs, I'm thankin' you now
Was watchin' you when you was pavin' the ground
I copied your cadence, I mirrored your style
I studied the greats, I'm the greatest right now
Fuck if you feel me, you ain't got a choice
I ain't do no promo, still made all that noise
This year gon' be different, I set my intentions
I promise to slap all that hate out your voice

Niggas been countin' me out
I'm countin' my bullets, I'm loadin' my clips
I'm writin' down names, I'm makin' a list
I'm checkin' it twice and I'm gettin' 'em hit
The real ones been dyin', the fake ones is lit
The game is off balance, I'm back on my shit
The Bentley is dirty, my sneakers is dirty
But that's how I like it, you all on my dick

I just poured somethin' in my cup
I've been wantin' somethin' I can feel
Promise I am never lettin' up
Money in your palm don't make you real
Foot is on they neck, I got 'em stuck
I'ma give 'em somethin' they can feel
If it ain't 'bout the squad, don't give a fuck
Pistol in your hand don't make you real

I'm dead in the middle of two generations
I'm little bro and big bro all at once
Just left the lab with young 21 Savage
I'm 'bout to go and meet Jigga for lunch
Had a long talk with the young nigga Kodak
Reminded me of young niggas from 'Ville
Straight out the projects, no fakin', just honest
I wish that he had more guidance, for real
Too many niggas in cycle of jail
Spending they birthdays inside of a cell
We coming from a long bloodline of trauma
We raised by our mamas, Lord, we gotta heal
We hurting our sisters, the babies as well
We killing our brothers, they poisoned the well
Distorted self-image, we set up to fail
I'ma make sure that the real gon' prevail, nigga

I just poured somethin' in my cup
I've been wantin' somethin' I can feel
Promise I am never lettin' up
Money in your palm don't make you real
Foot is on they neck, I got 'em stuck
I'ma give 'em somethin' they can feel
If it ain't 'bout the squad, don't give a fuck
Pistol in your hand don't make you real

Money in your palm don't make you real
Pistol in your hand don't make you real
Money in your palm don't make you real","Hip-Hop, rap, hip hop, North Carolina, underground hip-hop"
25,26,"""Drip Too Hard""",Lil Baby and Gunna,"5 ContributorsTranslationsEnglishTürkçeDanskLil Baby & Gunna - Drip Too Hard (Русский перевод) Lyrics

Run that back, Turbo

Ты можешь купить самую большую сумку Chanel, если ты хочешь
Я дал им дрипа, они высосали его, я заставил их стонать
Я купил новый Patek, у меня были часы, так что я их наложил друг на друга
Принимая наркотики, я буду на ногах до утра
Это не твоя машина, ты просто арендатор, ты ей не владеешь
Если я буду в клубе, я зажигаю во время выступления
Доход доходит до меня в размере сотни
Запах galore, милое дерьмо, это всё на нас
Я из Атланты, где молодые ниггеры заправляют дерьмом
Я знаю, они ненавидят меня, но я не читаю комментарии
Каждый раз, когда я говорю ей прийти, она приходит
Каждый раз, когда на нас бычат, мы не бежим

Дрип слишком сильный, не стой слишком близко
Наебнёшься и утонешь в этой волне
Даю концерты, я был в дороге
Мне всё равно, куда я иду, пока мне платят
Плохое настроение, она была у меня на уме
Как только я возвращаюсь, ебу её как зверь
Делаю это всё время, это не удивительно
Каждую ночь снимаю с ней очередной фильм
Дрип слишком сильный, не стой слишком близко
Наебнёшься и утонешь в этой волне
Даю концерты, я был в дороге
Мне всё равно, куда я иду, пока мне платят
Плохое настроение, она была у меня на уме
Как только я возвращаюсь, ебу её как зверь
Делаю это всё время, это не удивительно
Каждую ночь снимаю с ней очередной фильм

Е, каждую вторую ночь зарабатываю доллар
Каждый вечер начинается с хорошего дня
Я чувствую себя ребенком, у меня сопли на лице
Бриллианты танцующий в циферблате, как будто на параде
Мне не нужна твоя цепочка, молодой GonWunna не раб
Я должен был провести черту, слишком много сучек были спасены
TSA донимает меня, так что я сел на частный  самолет
Эти пиздюки, вот почему я работаю над своей целью
Дрип слишком сильный (Слишком сильный), опустошаю на карточку (Карточку)
Дизайнер на земле, я едва могу произнести имена
Дрип слишком сильный, осторожно на полу
Наебнёшься и утонешь на этой волне

Дрип слишком сильный, не стой слишком близко
Наебнёшься и утонешь в этой волне
Даю концерты, я был в дороге
Мне всё равно, куда я иду, пока мне платят
Плохое настроение, она была у меня на уме
Как только я возвращаюсь, ебу её как зверь
Делаю это всё время, это не удивительно
Каждую ночь снимаю с ней очередной фильм
Дрип слишком сильный, не стой слишком близко
Наебнёшься и утонешь в этой волне
Даю концерты, я был в дороге
Мне всё равно, куда я иду, пока мне платят
Плохое настроение, она была у меня на уме
Как только я возвращаюсь, ебу её как зверь
Делаю это всё время, это не удивительно
Каждую ночь снимаю с ней очередной фильм",
26,27,"""Someone You Loved""",Lewis Capaldi,"229 ContributorsTranslationsSvenskaEspañolPortuguêsDeutschNederlandsFrançaisالعربيةTürkçeSomeone You Loved LyricsDuring his speech at The BRIT Awards 2020, Lewis confirmed that contrary to popular belief, this song is about his grandmother (as opposed to an ex-lover).
The music video, starring the former Doctor Who… Read More 
I'm going under, and this time, I fear there's no one to save me
This all or nothing really got a way of driving me crazy
I need somebody to hear,  somebody to know
Somebody to have, somebody to hold
It's easy to say, but it's never the same
I guess I kinda liked the way you numbed all the pain

Now, the day bleeds into nightfall
And you're not here to get me through it all
I let my guard down and then you pulled the rug
I was getting kinda used to being someone you loved

I'm going under, and this time, I fear there's no one to turn to
This all or nothing way of loving got me sleeping without you
Now, I need somebody to know, somebody to hear
Somebody to have, just to know how it feels
It's easy to say, but it's never the same
I guess I kinda like the way you help me escape

Now, the day bleeds into nightfall
And you're not here to get me through it all
I let my guard down and then you pulled the rug
I was getting kinda used to being someone you loved

And I tend to close my eyes when it hurts sometimes
I fall into your arms
I'll be safe in your sound till I come back around

For now, the day bleeds into nightfall
And you're not here to get me through it all
I let my guard down and then you pulled the rug
I was getting kinda used to being someone you loved
But now the day bleeds into nightfall
And you're not here to get me through it all
I let my guard down and then you pulled the rug
I was getting kinda used to being someone you loved
I let my guard down and then you pulled the rug
I was getting kinda used to being someone you loved","pop, Scottish, pop rock, singer-songwriter, alternative"
27,28,"""Ransom""",Lil Tecca,"246 ContributorsTranslationsРусский (Russian)FrançaisDeutschRansom LyricsOn “Ransom,” Lil Tecca shares some braggadocious lines about his newfound fame and the lifestyle it implies—he boasts about his luxury vehicles, designer clothes and his women.
The track was long-awaited by… Read More 
Turn you to a dancer
Yeah
Internet Money, bitch

I got black, I got white, what you want?
Hop outside a Ghost and hop up in a Phantom
I know I'm ’bout to blow, I ain't dumb
They try to take my flow, I take they ass for ransom
I know that I'm gone
They see me blowin’ up, now they say they want some
I got two twin Glocks, turn you to a dancer
I see two twin opps, leave 'em on a banner
And I got two thick thots, wanna link the gang, yeah

I got red, I got blue, what you want?
The Chanel or Balenciaga, Louis and Vuitton
She know I got the Fendi, Prada when I hit Milan
I needed me a die or rider, I need me the one
I started from the bottom, you could see the way I stunt
I want all the diamonds, I want that shit to weigh a ton
The opps, they tryna line me 'cause they hate the place I'm from
But them niggas don't know me, they just know the place I'm from
I got lots of shawties tryna pull up to my place
But you ain't want me last year, so just get up out my face
They all up in my inbox, so I know they want a taste
I know they want my downfall, lil' nigga, are you laced?

I got black, I got white, what you want?
Hop outside a Ghost and hop up in a Phantom
I know I’m ’bout to blow, I ain't dumb
They try to take my flow, I take they ass for ransom
I know that I’m gone
They see me blowin' up, now they say they want  some
I got two twin Glocks, turn you to a dancer
I see two twin opps, leave 'em on a banner
And I got two thick thots, wanna link the gang, yeah
I got black, I got white, what you want?
Hop outside a Ghost and hop up in a Phantom
I know I'm ’bout to blow, I ain't dumb
They try to take my flow, I take they ass for ransom
I know that I'm gone
They see me blowin' up, now they say they want  some
I got two twin Glocks, turn you to a dancer
I see two twin opps, leave 'em on a banner
And I got two thick thots, wanna link the gang, yeah","rap, Hip-Hop, trap, hip hop, new york"
