Unnamed: 0,No.,Title,Artist(s),lyrics,genres
73,74,"""Close Friends""",Lil Baby,"97 ContributorsTranslationsРусский (Russian)PortuguêsClose Friends LyricsOn this song, Lil Baby discusses the importance of becoming “Close Friends” with a woman before dating her. However, their relationship has soured due to Baby’s unfaithful actions, and he’s now pleading to… Read More 
Oh, this the one right here, Wicked?
Okay
Yeah, yeah
Run that back, Turbo

We started off as close friends (Close friends)
Somehow you turned into my girlfriend (My girlfriend)
We used to tell each other everything (Everything)
I even went and bought her diamond rings, matching earrings
Everything was so cool (So cool)
Lately baby been actin' so rude (Been so rude)
I don't know what somebody told you (What they told you)
But I ain't gon' lie, I miss the old you

I know you remember how I would hold you
Still remember how I approached you
I think I loved you 'fore I knew you
Know we be fuckin' 'fore I screwed you
Made a promise I won't use you
Play my cards right, I won't lose you
Got 'em tuned in like I'm YouTube
Got somethin' on me like it's voodoo
I'll go nuts for you, go cuckoo, lose my cool and all
And I know that shit was wrong, I shouldn't've did what I did

Just wipe your eyes and stop this cryin'
I told the truth, that I'd been lyin'
I gave you racks, I tried to buy in
I even did the unthinkable, and I'm sorry for what I did to you
Take me back, if I was you and I did what I did
I probably would, I probably wouldn't
Take you back, if I was you and I did what I did
I probably would, I probably wouldn't
Just wipe your eyes and stop this cryin'
I told the truth, that I'd been lyin'
I gave you racks, I tried to buy in
I even did the unthinkable, and I'm sorry for what I did to you

We started off as close friends (Close friends)
Somehow you turned into my girlfriend (My girlfriend)
We used to tell each other everything (Everything)
I even went and bought her diamond rings, matching earrings
Everything was so cool (So cool)
Lately baby been actin' so rude (Been so rude)
I don't know what somebody told you (What they told you)
But I ain't gon' lie, I miss the old you

Keep our business to ourselves
The internet ain't doin' no help
I know I shouldn't've never left
But everything I did for us
And us, I'm speakin' on my kids
Thinkin' 'bout this shit I did
Like how the hell I get myself involved in this bullshit?
Married to the game, I can't make you my fiancée
Bad young boss bitch, treat her like Beyoncé
But damn what them broads say, I fucked them all the first day
And that's why you trippin' anyway, like when I fuck 'em I don't pay
Even if we never speak again
I'll make sure you're ridin' in the latest Benz
Keep your business all apart if you can stay out of mine
Bought a brand new Audemars, but I done ran out of time

We started off as close friends (Close friends)
Somehow you turned into my girlfriend (My girlfriend)
We used to tell each other everything (Everything)
I even went and bought her diamond rings, matching earrings
Everything was so cool (So cool)
Lately baby been actin' so rude (Been so rude)
I don't know what somebody told you (What they told you)
But I ain't gon' lie, I miss the old you","rap, Hip-Hop, hip hop, trap, atlanta"
74,75,"""Baby Shark""",Pinkfong,"95 ContributorsTranslationsPortuguêsBaby Shark Lyrics“Baby Shark” is a nursery dance song about a family of sharks. The song seems to be originated from a German song called “Kleiner Hai” by Alemuel.
On June 17, 2016, the PinkFong YouTube channel uploaded the… Read More Baby shark, doo-doo-doo-doo-doo-doo
Baby shark, doo-doo-doo-doo-doo-doo
Baby shark, doo-doo-doo-doo-doo-doo
Baby shark
Mommy shark, doo-doo-doo-doo-doo-doo
Mommy shark, doo-doo-doo-doo-doo-doo
Mommy shark, doo-doo-doo-doo-doo-doo
Mommy shark
Daddy shark, doo-doo-doo-doo-doo-doo
Daddy shark, doo-doo-doo-doo-doo-doo
Daddy shark, doo-doo-doo-doo-doo-doo
Daddy shark
Grandma shark, doo-doo-doo-doo-doo-doo
Grandma shark, doo-doo-doo-doo-doo-doo
Grandma shark, doo-doo-doo-doo-doo-doo
Grandma shark
Grandpa shark, doo-doo-doo-doo-doo-doo
Grandpa shark, doo-doo-doo-doo-doo-doo
Grandpa shark, doo-doo-doo-doo-doo-doo
Grandpa shark
Let's go hunt, doo-doo-doo-doo-doo-doo
Let's go hunt, doo-doo-doo-doo-doo-doo
Let's go hunt, doo-doo-doo-doo-doo-doo
Let's go hunt

Run away, doo-doo-doo-doo-doo-doo
Run away, doo-doo-doo-doo-doo-doo
Run away, doo-doo-doo-doo-doo-doo
Run away
Safe at last, doo-doo-doo-doo-doo-doo
Safe at last, doo-doo-doo-doo-doo-doo
Safe at last, doo-doo-doo-doo-doo-doo
Safe at last
It's the end, doo-doo-doo-doo-doo-doo
It's the end, doo-doo-doo-doo-doo-doo
It's the end, doo-doo-doo-doo-doo-doo
It's the end","south korea, goregrind, kids, cartoon, children"
75,76,"""My Type""",Saweetie,"57 ContributorsMy Type LyricsAnother viral hit from California’s finest, Saweetie released “My Type,“ tapping into nostalgia with a sample of the 2004 “Freek-A-Leek” by Petey Pablo.
Adding fuel to her fire, Saweetie released her “My… Read More 
Hennessy on my lips, take a little sip
Privacy on the door, I'ma make the shit grip

Rich nigga, eight-figure, that's my type
That's my type, nigga, that's my type
Eight-inch big, ooh, that's good pipe
Bad bitch, I'ma ride the dick all night
Rich nigga, eight-figure, that's my type
That's my type, nigga, that's my type
Eight-inch big, ooh, that's good pipe
That's my type, nigga, that's my type

New wrist, new whip, ride around dipped
I can see why all these basic hoes pissed

Bust down wrist, not a bust down bitch (Ah)
Said I want your man, no the fuck I don't, sis (Uh, uh)
If he a rich nigga, why he still hitting licks? (Licks)
Nigga spending bread but he still can't hit
Bitch please (Bitch), Lamborghini keys
Pussy dripping ice, he get flown out to me
Bitch please, I want a man with the Bs (Yeah)
Pussy from the Bay, goin' dumb on the D (Hahaha)

Hennessy on my lips, take a little sip
Privacy on the door, I'ma make the shit grip

Rich nigga, eight-figure, that's my type
That's my type, nigga, that's my type
Eight-inch big, ooh, that's good pipe
Bad bitch, I'ma ride the dick all night
Rich nigga, eight-figure, that's my type
That's my type, nigga, that's my type
Eight-inch big, ooh, that's good pipe
That's my type, nigga, that's my type

New wrist, new whip, ride around dipped
I can see why all these basic hoes pissed

Messy hoes like to pop shit (Messy hoes)
You the type that's fuckin' for the rent (You a thot)
All on another nigga dick (On the dick)
Hair ain't nothin' with a inch (Hahaha)
Do it on his face with a thizz (Ugh)
I'm a boss tycoon with the shit (What)
Run it up (Uh), print it up, big bucks (Ayy, ayy)
Try your luck (Uh), none of my bitches been touched

Hennessy on my lips, take a little sip
Privacy on the door, I'ma make the shit grip

Rich nigga, eight-figure, that's my type
That's my type, nigga, that's my type
Eight-inch big, ooh, that's good pipe
Bad bitch, I'ma ride the dick all night
Rich nigga, eight-figure, that's my type
That's my type, nigga, that's my type
Eight-inch big, ooh, that's good pipe
That's my type, nigga, that's my type","Hip-Hop, rap, better than selena gomez, urban, female rapper"
76,77,"""Worth It""",YK Osiris,"64 ContributorsWorth It LyricsThis song talks about how YK Osiris loves his girl so much that he’ll give her absolutely whatever she wants as long as she’s good to him. He also doesn’t care about any unimportant stuff. He doesn’t care… Read More 
I would give you the world, nah, nah, nah
(Yo Kiwi, thank you bro)
You just gotta be worth it, yeah, yeah, yeah, yeah

I would give you the world, baby girl
You just gotta be worth it (Oh, oh, oh)
You don't gotta be perfect (Mm, mm, mm)
You just gotta be worth it, yeah, yeah, yeah, yeah
I would give you the world, baby girl
You just gotta be worth it, yeah, yeah
But you don't gotta be perfect (Oh, oh, oh)
You just gotta be worth it, yeah, yeah, yeah, nah, nah

Everybody doubted me, but girl, you stuck around
And you told me, ""If I hold you you gon' hold me down""
You don't gotta be perfect, you just gotta be worth it
Buyin' this and that, baby girl, you don't ever have to work again
Time is precious, baby girl, let's not let it go by
I just really wanna know, do you love me? Don't lie
I know you felt alone, huh, 'cause I been on the road, huh
But I been doin' shows, I swear I ain't doin' you wrong
Ridin' 'round through the city, yeah
Girl, you know you comin' with me, yeah
I been a hundred out of fifty, girl
Ain't nobody messin' with me, yeah
I don't really think they understand
Baby girl, I know you understand
I'm just tryna go feed my fam, hey-ey-ey, nah

I would give you the world, baby girl
You just gotta be worth it (Oh, oh, oh)
You don't gotta be perfect (Mmh, mmh, mmh)
You just gotta be worth it, yeah, yeah, yeah, yeah
I would give you the world, baby girl
You just gotta be worth it, yeah, yeah
But you don't gotta be perfect (Oh, oh, oh)
You just gotta be worth it, yeah, yeah, yeah, nah, nah

Oh-woah, woah, nah, nah, nah
Nah, nah, nah

I would give you the world, baby girl
You just gotta be worth it (Oh, oh, oh)
You don't gotta be perfect (Mmh, mmh, mmh)
You just gotta be worth it, yeah, yeah, yeah, yeah
I would give you the world, baby girl
You just gotta be worth it, yeah yeah
But you don't gotta be perfect (Oh, oh, oh)
You just gotta be worth it, yeah, yeah, yeah, nah, nah","soul, rap, Hip-Hop, rnb, florida"
77,78,"""Only Human""",Jonas Brothers,"57 ContributorsTranslationsEspañolOnly Human Lyrics
Woo, hey
Yeah
Ayy

I don't want this night to end
It’s closing time, so leave with me again (Yeah)
You got all my love to spend, oh
Let's find a place where happiness begins

We gon' dance in my living room, slave to the way you move
Hurts when I’m leaving you (Ayy)
Just dance in the living room, love with an attitude
Drunk to an '80s groove (Ayy)
We gon' dance in my living room, slave to the way you move
Hurts when I'm leaving you (Ayy)
Dance in the living room, love with an attitude
Drunk

It's only human, you know that it's real
So why would you fight or try to deny the way that you feel?
Oh, babe, you can't fool me, your body's got other plans
So stop pretending you’re shy, just come on and
Dance, dance, dance, dance, oh

Early morning la-la-light
Only getting up to close the blinds, oh
I’m praying you don't change your mind
’Cause leaving now just don't feel right
Let's do it one more time, oh, babe

We gon' dance in my living room, slave to the way you move
Hurts when I’m leaving you (Hurts when I'm leaving you)
Just dance in the living room, love with an attitude
Drunk to an '80s groove (Ayy)
We gon' dance in my living room, slave to the way you move
Hurts when I'm leaving you (Ayy)
Dance in the living room, love with an attitude
Drunk

It's only human, you know that it's real (Know that it's real)
So why would you fight or try to deny the way that you feel?
(The way that you feel)
Oh, babe, you can't fool me, your body's got other plans
So stop pretending you're shy, just come on and
Dance, dance, dance, dance, oh

Dance, oh (Woo, ayy)
Only human
It's only (-man), it's only (-man)
Only human
Oh yeah, yeah, yeah
Only human
It's only (-man), it's only (-man)
Only human","pop, pop rock, Disney, rock, pop punk"
78,79,"""Knockin' Boots""",Luke Bryan,"15 ContributorsKnockin’ Boots Lyrics
This truck needs a half tank
These wheels need a two-lane
This radio needs three songs to play
To get me 'cross town to you
That dress needs to slip off
That hair needs to come down
Friday nights need to do
What Friday nights need to do
That's the truth

Yeah, birds need bees and ice needs whiskey
Boys like me need girls like you to kiss me
""Fishin' in the Dark"" needs Nitty Gritty
Under that pale moon
Sweet tea needs that sugar stirrin'
Small town nights need both ends burnin'
Shades need drawin', hearts need fallin'
Boots need knockin', knockin' boots
Knockin' boots, me and you, oh

Long weeks need a weekend
Cheap drinks need a-slingin'
That dance floor needs some me on you
And you on me tonight
Singalongs need to be sung
Tip bells need to be rung
Last calls need a call that cab
And backseats need I want you so bad

Yeah, birds need bees and ice needs whiskey
Boys like me need the girls like you to kiss me
""Fishin' in the Dark"" needs Nitty Gritty
Under that pale moon
Sweet tea needs that sugar stirrin'
Small town nights need both ends burnin'
Shades need drawin', hearts need fallin'
Boots need knockin', knockin' boots
Knockin' boots, girl, me and you

Doors need shuttin'
Lights need cuttin'
Lips need lockin'
Boots need knockin'

And birds need bees and ice needs whiskey
Boys like me need girls like you to kiss me
""Fishin' in the Dark"" needs Nitty Gritty
Under that pale moon
Sweet tea needs that sugar stirrin'
Small town nights need both ends burnin'
Shades need drawin', hearts need fallin'
Boots need knockin', knockin' boots
Mmm, knockin' boots, me and you, oh
Knockin' boots","country, new country, modern country, male vocalists, country rock"
79,80,"""Trip""",Ella Mai,"86 ContributorsTrip LyricsAfter charting a top-five hit with “Boo’d Up” on the Hot 100, Ella Mai attempts to strike gold again with her new record “Trip.”
The piano-laden song finds Mai deeply entranced by the love she’s receiving in… Read More 
Ooh, yeah, yeah

I put my feelings on safety
So I don't go shootin' where your heart be
'Cause you take the bullet tryna save me
Then I'm left to deal with makin' you bleed

And that's a whole lotta love, ain't tryna waste it
Like we be runnin' a mile to never make it
That's just too bitter for worse, don't wanna taste it
That's just too bitter for worse, don't wanna face it
But I think that I'm done trippin', I'm trip-trippin'
I've been sippin', that's how I control
This feelin', you keep givin'
You keep on hittin' it, ooh, oh
Maybe it's your love, it's too good to be true
Baby boy, your love, got me trippin' on you
You know your love is big enough, make me trip up on you
Yeah, it's big enough, got me trippin' on you, trip-trippin' on you

My bad, my bad for, trippin' on you (Trippin' on you)
My bad, my bad for, trippin' on you (Trippin' on you)

Boy, you know we cool when I ain't waitin'
But I act a fool when I don't get it
And I'm steady bruisin' just to save this
But I tripped on your love, now I'm addicted

And that's a whole lotta love, ain't tryna waste it
Like we be runnin' a mile to never make it
That's just too bitter for worse, don't wanna taste it
That's just too bitter for worse, don't wanna face it
But I think that I'm done trippin', I'm trip-trippin'
I've been sippin', that's how I control
This feelin', you keep givin'
You keep on hittin' it, ooh, oh
Maybe it's your love, it's too good to be true
Baby boy, your love, got me trippin' on you
You know your love is big enough, make me trip up on you
Yeah, it's big enough, got me trippin' on you, trip-trippin' on you

My bad, my bad for, trippin' on you (Trippin' on you, trippin' on you)
My bad, my bad for, trippin' on you (Trippin' on you, trippin' on you)

That's some kind of love, baby (Drip, drip)
That's the type of love, make me (Trip, trip, trippin' on you)
It's big enough, make me (Drip, drip)
It's big enough, got me (Trip, trip, trippin' on you)

I'm done trippin', I'm trip-trippin'
I've been sippin', that's how I control
This feelin', you keep givin'
You keep on hittin' it, ooh, oh
Maybe it's your love, it's too good to be true
Baby boy, your love, got me trippin' on you
You know your love is big enough, make me trip up on you
Yeah, it's big enough, got me trippin' on you, trip-trippin' on you

My bad, my bad for, trippin' on you (My bad, my bad, my bad, trippin' on you, yeah)
My bad, my bad for, trippin' on you (Trippin' on you, trippin' on you, baby)
My bad, my bad for, trippin' on you (Trippin' on you)
Said I admit I was wrong when I did it
My bad, my bad, my bad for, trippin' on you (Trippin' on you, trippin' on you)

Trippin' on you, yeah, yeah
Ooh, yeah, yeah","rnb, soul, british, Hip-Hop, pop"
80,81,"""Rumor""",Lee Brice,"13 ContributorsRumor Lyrics
Girl you know I've known you forever
How many nights we hung out together
Same little crowd, little bar, little town
Round this old dance floor
My boys are laughing and tap me on the shoulder
Making a motion like ""'Could y'all get any closer?""
They wanna know what's up why I'm still holding ya
Even when the song is over

There's a rumor going round about me and you
Stirring up our little town the last week or two
So tell me why we even trying to deny this feeling
I feel it, don't you feel it too?
There's a rumor going round, and round, and round
What d'you say we make it true?
We make it true
Oh, we make it true

Well I can shut 'em down, tell them all they're crazy
I can do whatever you want me to do, baby
Or you could lay one on me right now
We could really give them something to talk about

There's a rumor going round about me and you
Stirring up our little town the last week or two
So tell me why we even trying to deny this feeling
I feel it, don't you feel it too?
There's a rumor going round, and round, and round
What d'you say we make it true, baby?

Oh be honest girl now
Do you want to do this or not?
Should we keep them talking, girl
Or should we just make them stop?

There's a rumor going round about me and you
Stirring up our little town the last week or two
So tell me why we even trying to deny this feeling
I feel it, and you feel it too
There's a rumor going round, and round, and round
Whatd'you say we make it-
Make it true?
Whatd'you say we make it true?
Come on over here
Let's really give them something to talk about, baby
There's a rumor going round","country, singer-songwriter, Lee Brice, modern country, male vocalists"
81,82,"""Swervin""",A Boogie wit da Hoodie featuring 6ix9ine,"85 ContributorsSwervin LyricsSeemingly as a reimbursement for his carrying verses and hook on “WAKA” off of DUMMY BOY, A Boogie reunites with 6ix9ine on a London On Da Track production to rap about their wild and explicit life, parties… Read More 
Uh
Yeah
Oh, that's London On Da Track, run that shit back
We got London On Da Track

Swervin’
How you look so perfect on your worst days?
Double C your purses, you deserve it
Niggas in your DM, they be thirsty (Thirsty), and in person
But you're curvin'
Curvy little body, love your surface (Surface)
Yeah, I’m all on your body, make you nervous
I like the way you keep up with your earnings
Yeah, it's okay, you be swervin'

I fuck you from the back and leave you turnin' (Turnin')
The type to make you feel like I'm so worth it (Worth it)
Blame my ex, that bitch, she did me dirty (Did me dirty)
Had me fall in love and then she curved me
(On God, swear to God, I don't wanna leave you, no)
New Louboutin, you would think I'm bleedin’ from my toes
Dick all inside of you, make you freeze, make you pose
I want you to get up on your knees and your toes
I see one of my enemies, they gon’ freeze like they cold
I swear I ain't no killer, but test me if you want
You don’t want my adrenaline rushin', leave me alone (Leave me alone)
So much shit up on my mind, I can't think straight
All my niggas rock designer like they scream (Grrat)
Got the AP covered, diamonds with baguettes, yeah
I thought everything was right, that's when you left, yeah

Swervin’ (Swervin')
How you look so perfect on your worst days? (Worst days)
Double C your purses, you deserve it
Niggas in your DM, they be thirsty (Thirsty), and in person (Person)
But you're curvin'
Curvy little body, love your surface (Surface)
Yeah, I'm all on your body, make you nervous
I like the way you keep up with your earnings
Yeah, it's okay, you be swervin'

Where these bitches at? I'm in the V with the tints
Got the FN on my body and a clip with hollow tips
Niggas say they gon' rob me and they still ain't do shit
Catch her waitin' in the lobby, and I'ma give her this dick
Man, where these niggas at? Man, where these niggas at?
We gon' pull up big bodies with the Rugers in the back
I got Rugers and the MAC's, pump leave a nigga flat
Talkin' hot, we spin the block, we gon' leave him where he at

Like, where these niggas at? Ayy, where these niggas at?
I'ma pull up in the big body with the fuckin' MAC
If the opps try to turn my song off, run it back
Used to have the pack in my long johns, now I rap

If a nigga wanna act out, got the MAC out
I ain't got no fuckin' back-up, that's a man down
I ain't got the fuckin' forty, knock his teeth off
Spin back with the Ruger, air the block out

Swervin' (Swervin')
How you look so perfect on your worst days? (Worst days)
Double C your purses, you deserve it
Niggas in your DM, they be thirsty (Thirsty), and in person (Person)
But you're curvin'
Curvy little body, love your surface (Surface)
Yeah, I'm all on your body, make you nervous
I like the way you keep up with your earnings
Yeah, it's okay, you be swervin'

The way that I live my life is amazing
Back-to-back big bodies, no more dreams, yeah
So much shit up on my mind, I couldn't think, yeah
All my niggas rock designer like they scream, yeah
Got the AP covered, diamonds with baguettes, yeah
Say my name in your song and it's lit, yeah
They been waiting for a nigga like this, yeah
We got London On Da Track",
82,83,"""How Do You Sleep?""",Sam Smith,"71 ContributorsTranslationsEspañolFrançaisNederlandsفارسیHow Do You Sleep? LyricsAfter weeks of teasing on Sam’s social media sites, this song was released on July 19th 2019. Sam said that they wanted to move on from heartbreak ballads, we can assume after slowly recovering from a painful… Read More 
I'm done hatin' myself for feelin'
I'm done cryin' myself awake
I gotta leave and start the healin'
But when you move like that, I just wanna stay

What have I become now?
Lookin' through your phone now
Oh now, love to you is just a game
Look what I have done now
Dialling up the numbers on you
I don't want my heart to break

Baby, how do you sleep when you lie to me?
All that shame and all that danger
I'm hopin' that my love will keep you up tonight
Baby, how do you sleep when you lie to me?
All that fear and all that pressure
I'm hopin' that my love will keep you up tonight

(Tell me, how do you—)
Love will keep you up tonight
(Tell me, how do you—)

Oh, no, how did I manage to lose me?
I am not this desperate, not this crazy
There's no way I'm stickin' 'round to find out
I won't lose like that, I won't lose myself

Look what I have done (Done)
Diallin' up the numbers on you
I don't want my heart to break

Baby, how do you sleep when you lie to me?
All that shame and all that danger
I'm hopin' that my love will keep you up tonight
Baby, how do you sleep when you lie to me?
All that fear and all that pressure
I'm hopin' that my love will keep you up tonight

(Tell me, how do you—)
Yeah, yeah, yeah
Love will keep you up tonight
(Tell me, how do you—)
Oh, love will keep you up tonight

Baby, how do you sleep when you lie to me?
All that shame and all that danger
I'm hopin' that my love will keep you up tonight
Baby, how do you sleep when you lie to me? (Oh)
All that fear and all that pressure (Oh)
I'm hopin' that my love will keep you up tonight
(Tell me, how do you—)","soul, pop, british, electronic, dance"
