Unnamed: 0,No.,Title,Artist(s),lyrics,genres
73,74,"""Morning Side of the Mountain""",Donny & Marie Osmond,"5 ContributorsMorning Side of the Mountain Lyrics There was a girl
 There was a boy
There was a girl, there was a boy
If they had met they might have found a world of joy
But he lived on the morning side of the mountain
And she lived on the twilight side of the hill
They never met, they never kissed
They will never know what happiness they've missed
'Cause he lived on the morningside of the mountain
And she lived on the twilight side of the hill
Both:
For love's a rose that never grows
Without the kiss of the morning dew
And every Jack must have a Jill
To know the thrill of a dream that comes true
And you and I are just like they
For all we know our love is just a kiss away
But you are on the morning side of the mountain
And you are on the twilight side of the hill
Both:
And you and I are just like they
For all we know our love is just a kiss away
But you are on the morning side of the mountain
And you are on the twilight side of the hill
There was a girl...
There was a boy...",
74,75,"""When Will I See You Again""",The Three Degrees,"18 ContributorsWhen Will I See You Again Lyrics
Ooh, ah
Ah, ooh, precious moments

When will I see you again?
When will we share precious moments?
Will I have to wait forever?
Will I have to suffer (Suffer)
And cry the whole night through?

When will I see you again?
When will our hearts beat together?
Are we in love or just friends?
Is this my beginning or is this the end? (Is this the end?)
When will I see you again?
(When will I see you again?)
When will I see you again, love?
Are we in love or just friends?
Is this my beginning or is this the end? (Is this the end?)
When will I see you again?

(When will I see you again?)
Sweet, sweet love of mine
(When will I see you again?)
Come on, come on
(When will I see you again?)
Tell me, yeah
(When will I see you again?)
My sweet lover, yeah
(When will I see you again?)
Ooh, yeah
(When will I see you again?)
Come on, come on
(When will I see you again?)
Come on, come on
(When will I see you again?)
Ooh ooh, yeah
(When will I see you again?)
(When will I see you again?)",
75,76,"""Get Down, Get Down (Get on the Floor)""",Joe Simon,"1 ContributorGet Down, Get Down (Get on the Floor) LyricsEverybody, won't you get on the floor
(Get on the floor and let the good time roll)
We're gonna Kung Fu bumpin' 'til it's time to go
(Get on the floor and let the good time roll)
Come on get down, get down (get down, get down)
Grab your partner and dance to the beat
(Get on the floor and let the good time roll) oh yeah
Let the music control your feet now
(Get on the floor and let the good time roll) oh yeah
Come on and party, baby
(Get down, get down) get down all night long
Baby, why don't ya
(Get down, get down) me and you
(Get down, get down) I know you're able
(Get down, get down) why don't you
Get on the floor and let the good time roll
Come on and let it roll
I feel the beat, I feel the heat
Everybody, won't you clap your hands and dance
(Get on the floor and let the good time roll) come on
All you gotta do is move your body, and shake what you can
Oh, baby (get on the floor and let the good time roll)
Oh, let me tell ya, you're lookin' good now
Come on, baby
(Get down, get down) get down
Come on and get down all the way, baby
(Get down, get down) I know you're able
(Get down, get down) don't put it off for later
(Get down, get down) why don't you
Get on the floor and let the good time roll

Everybody is lookin' good, now
(Get down on the floor and let the good time roll) oh yeah
And you're doin' that Kung Fu bumpin' like I know you could, now
(Get down on the floor and let the good time roll)
(Get down on the floor and let the good time roll) oh yeah
It ain't no harm, y'all
(Get down on the floor and let the good time roll)
It ain't no harm to do the bump
(Get down on the floor and let the good time roll)
But someone out there is doin' the devil bump
(Get down on the floor and let the good time roll) look out!
Go ahead and do your thing, baby
(Get down on the floor and let the good time roll) oh yeah
Come on and bump
(Get down on the floor and let the good time roll) oh baby
Come on and Kung Fu, Kung Fu, Kung Fu
(Get down on the floor and let the good time roll)
Kung Fu bumpin', now
(Get down on the floor and let the good time roll) oh yeah
Oh, you're doin' it tonight, baby
(Get down on the floor and let the good time roll) oh yeah
You got me feelin' good tonight, oh baby
(Get down on the floor and let the good time roll)
I ain't felt this good, oh honey
(Get down on the floor and let the good time roll)
Since I don't know when, good God almighty
(Get down on the floor and let the good time roll)

Might not, baby
(Get down on the floor and let the good time roll)
Oh honey, I might not feel this good again
(Get down on the floor and let the good time roll)
You see, that's why right now I'm gonna get out on the floor
(Get down on the floor and let the good time roll)
I'm gonna do my own thing tonight
(Get down on the floor and let the good time roll)
You see, somebody's doin' it like this
(Get down on the floor and let the good time roll)
Uh, ow (get down on the floor and let the good time roll)
Now, the cool cats are doin' it like this
(Get down on the floor and let the good time roll)
Ha-ha-ha... hey! Come on, come on, come on
(Get on the floor and let the good time roll)
Come on, come on, oh...",
76,77,"""I'm Sorry""",John Denver,"9 ContributorsI’m Sorry LyricsI’m Sorry topped the Billboard Hot 100, Hot Country Singles and Adult Contemporary chart in the fall of 1975.
It also peaked at #1 on the RPM Adult Contemporary Tracks chart in Canada & #4 on the Canadian… Read More 
It's cold here in the city
It always seems that way
And I've been thinking about you
Almost everyday
Thinking about the good times
Thinking about the rain
Thinking about how bad it feels
Alone again

I'm sorry for the way things are in China
I'm sorry things ain't what they used to be
But more than anything else, I'm sorry for myself
'Cause you're not here with me

Our friends all ask about you, I say you're doing fine
And I expect to hear from you almost anytime
But they all know I'm crying and I can't sleep at night
They all know I'm dying down deep inside

I'm sorry for all the lies I've told you
I'm sorry for the things I didn't say
But more than anything else
I'm sorry for myself
I can't believe you went away


I'm sorry
If I took some things for granted
I'm sorry
For the chains I put on you
But more than anything else
I'm sorry for myself
For living without you",
77,78,"""Killer Queen""",Queen,"157 ContributorsTranslationsEspañolKiller Queen Lyrics“Killer Queen” was the breakthrough song that turned Queen into worldwide rock stars. Peaking at #2 in the UK, the song became a hit in seven other European countries as well. “Killer Queen” was the first… Read More 
She keeps Moët et Chandon
In her pretty cabinet
""Let them eat cake"", she says
Just like Marie Antoinette
A built-in remedy
For Khrushchev and Kennedy (Ooh, ooh)
At anytime, an invitation you can't decline (Ooh, ooh)

Caviar and cigarettes
Well-versed in etiquette
Extraordinarily nice

She's a killer queen
Gunpowder, gelatine
Dynamite with a laser beam
(Pa-pa-pa-pa) Guaranteed to blow your mind
(Anytime) Ooh, recommended at the price
Insatiable an appetite
Wanna try?

To avoid complications
She never kept the same address
In conversation
She spoke just like a baroness
Met a man from China
Went down to Geisha Minah (Killer)
Then again incidentally (Killer)
If you're that way inclined (She's a killer queen)

Perfume came naturally from Paris (Naturally)
For cars, she couldn't care less
Fastidious and precise
She's a killer queen
Gunpowder, gelatine
Dynamite with a laser beam
(Pa-pa-pa-pa) Guaranteed to blow your mind
(Anytime)


Drop of a hat, she's as willing as
Playful as a pussycat
(Ooh) Then momentarily out of action
(Ooh) Temporarily out of gas (Ooh, da-da)
To absolutely drive (Drive you wild)
(Wild) She's out to get you
She's a killer queen
Gunpowder, gelatine
Dynamite with a laser beam
(Pa-pa-pa-pa) Guaranteed to blow your mind
(Anytime) Ooh, recommended at the price
Insatiable an appetite
Wanna try?

You wanna try?",
78,79,"""Shoeshine Boy""",Eddie Kendricks,"3 ContributorsShoeshine Boy Lyrics
Shoeshine boy, how you do your work so well?
Shoeshine boy tryin' to make a livin', you'll go somewhere
Shoeshine boy, where are you gonna be ten years from now?
(Just move, just keep workin') Shoeshine boy
I wanna know,  are you gonna be the richest man around?

You've been workin' so hard
So many things in life to learn
Shoeshine boy, what will you discover?

Though it's a long way up, you'll reach the top
Now, when you'll finally get back
Don't forget from where you came

Shoeshine boy, workin' so hard in the noon day sun
(Just, just keep workin' shoeshine boy)
Look at ya now, gettin' it together
Teasing the girls and havin' lots of fun
Shoeshine boy, yeah, don't you know that you're a star?
(Yeah, you're a star, shoeshine boy)
Just the way, just the way that you are

You've been workin' so hard
So many things in life to learn (There's so much to learn)
Shoeshine boy, what will you discover?

Yeah, shoeshine boy
Shoeshine boy
You've been workin' so hard
Shoeshine boy
Don't you know that you're a star
That's the way that you are
Hey",
79,80,"""Do It ('Til You're Satisfied)""",B.T. Express,"14 ContributorsDo It (’Til You’re Satisfied) LyricsOooooo
Go on and do it
Do it, do it 'til you're satisfied
(Whatever it is)
Do it, do it 'til you're satisfied
Go on and do it
Do it, do it 'til you're satisfied
(Whatever it is)
Do it, do it 'til you're satisfied
People know just what they'd like to do
Whatever it is you got it as long it pleases you
Make it last as long as you can
When your through it's up to you to try it again
Go on and do it
Do it, do it 'til you're satisfied
(Whatever it is)
Do it, do it 'til you're satisfied
Go on and do it
Do it, do it 'til you're satisfied
(Whatever it is)
Do it, do it 'til you're satisfied
Everybody knows what they'd like to do
Whatever it is, do it, as long as it pleases you
Just take some time and relax your mind
Then do it, do it, do it 'till you're satisfied

Go on and do it, now
Do it, do it 'til you're satisfied
(Whatever it is)
Do it, do it 'til you're satisfied
Go on and do it
Do it, do it 'til you're satisfied
(Whatever it is)
Do it now, do it 'til you're satisfied
Then you holler oh, oh-ho, oh-ho, oh
I'm satisfied, I'm satisfied
Then you holler oh, wooo-hooooo
Then you holler oh, oh-ho, oh-ho, oh
I'm satisfied, I'm satisfied
Then you holler oh, wooo-hooooo
Oooooo
Go on and do it
Do it, (do it slow) do it slow 'til you're satisfied
(Whatever it is)
Got to do it (Just do it some more)
Go on and do it
Do it, do it 'til you're satisfied
(Whatever it is)
Do it, do it 'til you're satisfied

Do it, do it 'til you're satisfied
(Whatever it is)
Got to do it
Do it, do it 'til you're satisfied
Go on and do it, girl
(Do it slow)
Got to do it
(Whatever it is)
Got to do it good
(Just do it some more)
Do it until you're satisfied
I'm satisfied, I'm satisfied
I'm satisfied, I'm satisfied
I'm satisfied, I'm satisfied
I'm satisfied
Go on and do it, yeah yeah",
80,81,"""Can't Get It Out of My Head""",Electric Light Orchestra,"26 ContributorsCan’t Get It Out of My Head LyricsThe second track on their 4th album – Eldorado, it was ELO’s first top 10 hit in the USA.

The album was a concept album/rock opera that follows “the Dreamer”, the main character of the album; a Walter… Read More 

Midnight on the water
I saw the ocean's daughter
Walking on a wave's chicane
Staring as she called my name

And I can't get it out of my head
No, I can't get it out of my head
Now my old world is gone for dead
'Cause I can't get it out of my head

Breakdown on the shoreline
Can't move, it's an ebb tide
Morning don't get here tonight
Searching for her silver light

And I can't get it out of my head
No, I can't get it out of my head
Now my old world is gone for dead
'Cause I can't get it out of my head, no, no


Bank job in the city
Robin Hood and William Tell, Ivanhoe and Lancelot
They don't envy me, yeah
Sitting 'til the sun goes down
In dreams, the world keeps going
'Round and 'round

And I can't get it out of my head
No, I can't get it out of my head
Now my old world is gone for dead
'Cause I can't get it out of my head, no, no

Oh, I can't get it out of my head
No, I can't get it out of my head
Now my old world is gone for dead
'Cause I can't get it out of my head, no, no, no, no",
81,82,"""Sha-La-La (Make Me Happy)""",Al Green,"12 ContributorsSha-La-La (Make Me Happy) LyricsSha la la la-- la la la
Oh baby
Sha la la la-- la la la
Oh baby
I've been gone so long I know what to do
Oh baby
That I know you don't know what I've been going through
Oh baby
'cause you make me happy baby, so I can say
Sha la la la-- la la la
I love you
Sha la la la-- la la la
Thinkin' of you
I know you can tell what's on my mind
Oh baby
And I've been feeling this way for such a long time
Ya, baby
Aw, make me happy baby, aw, make me happy, I wanna say
I'm trying, this feeling just won't die
Oh
Sha la la la-- la la la
Make you cry
It's something that just gets down in your bones
Baby
And once I see you I can't leave your love alone
Ya, heh, baby
Aw, make me happy baby, aw, make me happy baby, let me sing

Sha la la la-- la la la
Oh baby
Sha la la la-- la la la
Oh baby...",
82,83,"""Lonely People""",America,"13 ContributorsLonely People Lyrics
This is for all the lonely people
Thinkin' that life has passed them by

Don't give up until you drink from the silver cup
And ride that highway in the sky

This is for all the single people
Thinkin' that love has left them dry

Don't give up until you drink from the silver cup
You never know until you try

Well, I'm on my way
Yes, I'm back to stay
Well, I'm on my way back home (Hit it)


This is for all the lonely people
Thinkin' that life has passed them by

Don't give up until you drink from the silver cup
And never take you down or never give you up
You never know until you try",
83,84,"""You Got the Love""",Rufus,"10 ContributorsYou Got the Love Lyrics
Love me right
What's the matter with you?
Hold me tight
Why must I tell you what to do?
Smilin', smilin'
Comes as no surprise
Smile ain't hidin'
What I see in your eyes
The story goes, oh, much deeper
Than the eye can see, yes, it do
Stop runnin' a game
I can tell you're avoiding me, uh huh

Oh, ain't nothin'
I wouldn't pay
Just to hear, hear you say
I love you
I need you

Love me right
What's the matter with you?
Hold me tight
Why must I tell you what to do?
Smilin', smilin'
Comes as no surprise
Smile ain't hidin'
What I see in your eyes

You got the love
Gimme the strength
To keep on livin', yeah
Whatever it is
I can't do without what you're givin'

Ain't nothin'
I wouldn't pay
Oh, just to hear, Just to hear you say
I love you
I need you

You got the love
Gimme the strength
To keep on livin', yeah
Whatever it is
I can't do without what you're givin'
You got the love
Gimme the strength
To keep on livin', yeah
Whatever it is
I can't do without what you're givin'
You got the love
Gimme the strength
To keep on livin', yeah
Whatever it is",
84,85,"""The Rockford Files Theme""",Mike Post,,
85,86,"""It Only Takes a Minute""",Tavares,"7 ContributorsIt Only Takes a Minute LyricsYeah yeah
What's an hour of the day?
We throw at least one away
Walk the streets half a year
Tryin' to find a new career
Now if you get a flu attack
For 30 days you're on your back
Through the night I'll sing and dance
Baby, give me half a chance
It only takes a minute girl
To fall in love, to fall in love
It only takes a minute girl
To fall in love, let's fall in love
Now in the unemployment lines
You can spend your life readin' signs
Waitin' for your interview
They can shoot the whole day for you
(Yeah)
Now winter's gonna turn to spring
And you haven't accomplished a thing
(Haven't accomplished a thing)
So baby, leave a little time
'Cause you never know what's on my mind, yeah

It only takes a minute girl
To fall in love, to fall in love
It only takes a minute girl, yeah
To fall in love, let's fall in love
Well, you find yourself a few minutes (Fall in love)
When you wanna fry yourself an egg (Fall in love)
Now, you spare a few seconds girl (Fall in love)
When you see, when you see a man beg (Fall in love)
Now it takes some time (Fall in love)
To go down to the corner store (Fall in love)
Well, what I've got in mind girl (Fall in love)
Give me 60 seconds, no more (Fall in love)
Oh, it only takes a minute girl (Baby)
To fall in love, to fall in love
It only takes a minute girl (Girl)
To fall in love, let's fall in love
Bom, bom, bom, bom, fall in love
Bom, bom, bom, bom, fall in love
Bom, bom, bom, bom, fall in love
Bom, bom, bom, bom, fall in love
Bom, bom, bom, bom, fall in love
Bom, bom, bom, bom, fall in love

It only takes a minute girl (Baby)
To fall in love, to fall in love
It only takes a minute, girl
To fall in love, let's fall in love (Fall in love)
Only takes a minute, girl (To fall, to fall) (Baby)
To fall in love, fall in love (Yeah)
It only takes a minute girl (Girl)
Come on fall in love, let's fall in love
It only takes a minute girl",
86,87,"""No No Song""",Ringo Starr,"2 ContributorsNo No Song LyricsHuh-huh! Huh-huh!
(Ah-ah-ah-ah-ah)
(Aye-aye-aye-aye)
A lady that I know just came from Columbia
She smiled because I did not understand
Then she held out some marijuana, ha ha
She said it was the best in all the land
And I said
""No, no, no, no, I don't smoke it no more
I'm tired of waking up on the floor
No, thank you, please, it only makes me sneeze
And then it makes it hard to find the door""
(Ah-ah-aye-aye)
A woman that I know just came from Majorca, Spain
She smiled because I did not understand (Parazzi! Parazzi!)
Then she held out a ten pound bag of cocaine
She said it was the finest in the land
And I said
""No, no, no, no, I don't  no more
I'm tired of waking up on the floor
No, thank you, please, it only makes me sneeze
And then it makes it hard to find the door""

(Aye-aye-aye-aye)
(Aye-aye-aye-aye)
(Aye-aye-aye-aye)
(Aye-aye-aye)
A man I know just came from Nashville, Tennessee, oh
He smiled because I did not understand
Then he held out some moonshine whiskey, oh ho
He said it was the best in all the land (And he wasn't joking!)
And I said
""No, no, no, no, I don't drink it no more
I'm tired of waking up on the floor
No, thank you, please, it only makes me sneeze
And then it makes it hard to find the door""
Well, I said
""No, no, no, no, I can't take it no more
I'm tired of waking up on the floor
No, thank you, please, it only makes me sneeze
And then it makes it hard to find the door""",
87,88,"""Junior's Farm""",Paul McCartney & Wings,"22 ContributorsJunior’s Farm Lyrics“Junior’s Farm” was recorded by Wings in July 1974. It was released as a non-album single with b-side “Sally G” in October 1974 and would be McCartney’s last release on the Beatles' Apple Records. The song… Read More 
You should have seen me with the poker man
I had a honey and I bet a grand
Just in the nick of time, I looked at his hand

I was talking to an Eskimo
Said he was hoping for a fall of snow
When up popped a sea lion ready to go

Let's go, let's go, let's go, let's go
Down to Junior's Farm where I want to lay low
Low life, high life, oh, let's go
Take me down to Junior's Farm
Take me down!
Take me down, Jimmy!


At the Houses of Parliament
Everybody's talking about the President
We all chip in for a bag of cement

Ollie Hardy should have had more sense
He bought a gee-gee and he jumped the fence
All for the sake for a couple of pence

Let's go, let's go, let's go, let's go
Down to Junior's Farm where I want to lay low
Low life, high life, oh, let's go
Take me down to Junior's Farm
Let's go, let's go
Down to Junior's Farm where I want to lay low
Low life, high life, oh, let's go
Take me down to Junior's Farm
Everybody tag along
Ha!  Huh, ha!

I took my bag into a grocery store
The price is higher than the time before
Old man asked me, ""why is it more?""

I said you should have seen me with the poker man
I had a honey and I bet a grand
Just in the nick of time, I looked at his hand

Let's go, let's go, let's go, let's go
Down to Junior's Farm where I want to lay low
(Down to Junior's Farm.)
Low life, high life, oh, let's go
Take me down to Junior's Farm.  (Down to Junior's Farm.)
Let's go, let's go
Down to Junior's Farm where I want to lay low
(Down to Junior's Farm.)
Low life, high life, oh, let's go
Take me down to Junior's Farm  (Down to Junior's Farm.)
Everybody tag along  (Everybody tag along.)
Take me down to Junior's Farm right now

Ow!
Ah, ah, ah, ah, ah, ah, ah
Take me back
Take me back
I wanna go back
Yeah, yeah, yeah, eh",
88,89,"""Bungle in the Jungle""",Jethro Tull,"9 ContributorsBungle in the Jungle LyricsOne of the only singles from Jethro Tull that charted, this was released in 1974, and became the  group’s most played song in the USA.
This is a scathing attack on the “Dog eats Dog” society, and he does not… Read More {Intro}

Walking through forests of palm tree apartments
Scoff at the monkeys who live in their dark tents
Down by the waterhole, drunk every Friday
Eating their nuts, saving their raisins for Sunday
Lions and tigers who wait in the shadows
They're fast but they're lazy, and sleep in green meadows

Well, let's bungle in the jungle
Well, that's all right by me, yeah
Well, I'm a tiger when I want love
But I'm a snake if we disagree

Just say a word and the boys will be right there
With claws at your back to send a chill through the night air
Is it so frightening to have me at your shoulder?
Thunder and lightning couldn't be bolder
I'll write on your tombstone, and thank you for dinner
This game that we animals play is a winner

Well, let's bungle in the jungle
Well, that's all right by me, yes
I'm a tiger when I want love
I'm a snake if we disagree, yes

{Bridge}

The rivers are full of crocodile nasties
And he who made kittens put snakes in the grass
He's a lover of life but a player of pawns
Yes, the King on His sunset lies waiting for dawn
To light up His Jungle as play is resumed
The monkeys seem willing to strike up the tune

Well, let's bungle in the jungle
Well, that's all right by me, yes
I'm a tiger when I want love
And I'm a snake when we disagree, yes

Let's bungle in the jungle
Well, that's all right by me, yes
Well, I'm a tiger when I want love
And I'm a snake when we disagree",
89,90,"""Long Tall Glasses (I Can Dance)""",Leo Sayer,"7 ContributorsLong Tall Glasses (I Can Dance) Lyrics“Long Tall Glasses (I Can Dance)” was written by Leo Sayer and David Courtney in 1974. Released as a single, it also appears on Sayer’s 1979 compila-tion album, The Very Best of Leo Sayer.

This is a brief… Read More I was travellin' down the road feelin' hungry and cold
I saw a sign sayin' ""Food and Drinks for Everyone""
So naturally, I thought I would take me a look inside
I saw so much food there was water coming from my eyes
Yeah, there was ham and there was turkey, there was caviar
And long tall glasses with wine up to y'are
Then somebody grabbed me, threw me out of my chair
Said, ""Before you can eat, you gotta dance like Fred Astaire""
You know I can't dance, you know I can't dance
You know I can't dance, you know I can't dance, I can't dance!
I am a man of the road, a hobo by name
I don't seek entertainment, just poultry and game
But if it's all the same to you then yes, I will try my hand
If you were hungry as me then I'm sure you will understand
Hmm, now wait a minute, of course I can dance
Of course I can dance, I'm sure I can dance
I'm sure I can dance, I can dance
I can dance, I really hit the floor, ah, it feels good
Look at me dancin'!
I did a Two Step, Quick Step and a Bossanova
A little Victor Sylvester and a Rudy Valentino
You should have seen me moving right across the floor
Hand me down my tuxedo, next week I'm coming back for more

I can dance, oh yes, I can dance
Look at me dance on the floor movin'
I feel good, I can dance, I can dance
I can dance, I can dance, I can dance, I can dance
Songwriters:  Leo Sayer and David Courtney",
90,91,"""Misty""",Ray Stevens,"5 ContributorsMisty LyricsLook at me
I'm as helpless as a kitten up a tree
Ah, I'm walking on a cloud
I can't understand, Lord
I'm misty holding your hand
Walk my way
And a thousand violins begin to play
Or it might be the sound of your hello
That music I hear, Lord
I'm misty the moment you're near
You can say that you're leading me on
But it's just what I want you to do
Don't you notice how hopelessly I'm lost
That's why I'm following you, ooh
On my own
Should I wander through this wonderland alone, now
Never knowing my right foot from my left
My hat from my glove, Lord
I'm misty and too much in love
You can say that you're leading me on
But it's just what I want you to do
Don't you notice how hopelessly I'm lost
That's why I'm following you, ooh

On my own
Should I wander through this wonderland alone, now
Never knowing my right foot from my left
My hat from my glove, Lord
I'm misty, and too much in love
(Misty) Too much in love
(Misty) Too much in love
(Misty)
(Misty) Too much in love",
